institutions,title,principalInvestigator,startDate,endDate,subjects,fundingAmount,funder,startDate_clean,surrounded_by_square_brackets
Monash University,TreatOA4life (Treat OsteoArthritis4life) – a sustainable lifestyle treatment to improve outcomes in knee osteoarthritis,A/Pr Anita Wluka,2018,,"['Clinical Medicine and Science', 'osteoarthritis | weight control | knee osteoarthritis | metabolic syndrome | cardiovascular disease prevention']",179118.0,NHMRC,2018,False
Monash University,Defining reciprocal neural circuits that regulate appetite and memory,Dr Sarah Lockie,2018,,"['Basic Science', 'ghrelin | hypothalamus | hippocampus | appetite regulation | memory']",337214.0,NHMRC,2018,False
Monash University,Social dysfunction after paediatric brain injury in mice,Dr Bridgette Semple,2018,2020.0,"['Central Nervous System', 'MEDICAL AND HEALTH SCIENCES', 'NEUROSCIENCES', 'traumatic brain injury (TBI)', 'animal model', 'myelination', 'social and behavioural research', 'neuroimaging']",667033.94,NHMRC,2018,False
Monash University,Efficacy of a 3-month aerobic exercise regime for restoring 'brain health' in heavy cannabis users,Prof Murat Yucel,2018,2021.0,"['Biological Psychology (Neuropsychology, Psychopharmacology, Physiological Psychology)', 'PSYCHOLOGY AND COGNITIVE SCIENCES', 'PSYCHOLOGY', 'addiction', 'neuroscience', 'cannabis', 'brain imaging', 'substance misuse']",1226150.1,NHMRC,2018,False
Monash University,A Co-Designed Patient-Centred Model-of-Care for Gestational Diabetes,,2018,2020.0,"['Public Health and Health Services not elsewhere classified', 'MEDICAL AND HEALTH SCIENCES', 'PUBLIC HEALTH AND HEALTH SERVICES', 'gestational diabetes', 'health care delivery', 'health services research', 'self-management', 'shared care']",128224.82,NHMRC,2018,False
Monash University,Facilitating Venous Leg Ulcer Guideline implementation: Closing the Gap,Prof Carolina Weller,2017,,"['Health Services Research', 'venous leg ulcers | guidelines | public health policy | primary care | implementation']",177197.0,NHMRC,2017,False
Monash University,ASPREE- NEURO; aspirin and cerebral microhaemorrhages,Prof John McNeil,2015,,"['Clinical Medicine and Science', 'ageing | aspirin | brain imaging | clinical trial | neurocognitive assessment']",956186.0,NHMRC,2015,False
Monash University,"VCAM-targeted delivery of recombinant CD39 to the endothelium is antithrombotic, antiinflammatory and ameliorates ischaemia reperfusion injury.",Prof Harshal Nandurkar,2015,2018.0,"['110204', 'ischaemia/reperfusion', 'novel therapeutic agents', 'endothelium', 'thrombosis', 'inflammation']",623327.3,NHMRC,2015,False
Monash University,Attenuating severe infections in chronic inflammatory diseases through modulation of transforming growth factor-β activity,Prof Philip Bardin,2017,,"['Basic Science', 'infection | innate immunity | fibrosis | immune suppression | chronic diseases']",611793.0,NHMRC,2017,False
Monash University,Improving child health and development in resource-constrained settings: A multi-component study to inform policy and more effective interventions,Dr Thach Tran,2016,,"['Public Health', 'child health | malnutrition | statistics | developing countries | child development']",314644.0,NHMRC,2016,False
Monash University,Protein-RNA interactions in antiviral cellular defence and gene regulation,Prof Matthew Wilce,2015,2019.0,"['Structural Biology (incl. Macromolecular Modelling)', 'BIOLOGICAL SCIENCES', 'BIOCHEMISTRY AND CELL BIOLOGY', 'RNA', 'messenger RNA (mRNA)', 'innate immunity', 'gene regulation', 'molecular virology']",705501.1,NHMRC,2015,False
Monash University,Understanding the developmental basis of kidney disease,A/Pr Ian Smyth,2016,2020.0,"['Biochemistry and Cell Biology not elsewhere classified', 'BIOLOGICAL SCIENCES', 'BIOCHEMISTRY AND CELL BIOLOGY', 'developmental biology', 'developmental disorders', 'developmental genetics', 'kidney development', 'kidney disease']",643821.25,NHMRC,2016,False
Monash University,Targeting cytokine signalling in systemic lupus erythematosus,Dr Anthony Sadler,2018,2021.0,"['Signal Transduction', 'BIOLOGICAL SCIENCES', 'BIOCHEMISTRY AND CELL BIOLOGY', 'systemic lupus erythematosus (SLE)', 'type I interferon', 'transcriptional regulation', 'inflammation', 'cytokine signalling']",930472.4,NHMRC,2018,False
Monash University,Identification and targeting of a potent NK cell “checkpoint” in tumour immunity,A/Pr Nicholas Huntington,2017,,"['Basic Science', 'tumour immunotherapy | natural killer cells | tumour immunology | cytokine biology | cancer immunotherapy']",470144.0,NHMRC,2017,False
Monash University,Understanding G protein-coupled receptors,Prof Patrick Sexton,2014,2018.0,"['Basic Pharmacology', 'MEDICAL AND HEALTH SCIENCES', 'PHARMACOLOGY AND PHARMACEUTICAL SCIENCES', 'G protein-coupled receptors', 'drug discovery', 'signalling pathways', 'diabetes', 'obesity', 'neuropsychiatric disorders', 'bone disease']",763409.06,NHMRC,2014,False
Monash University,A neuro-immune axis regulates beige adipocyte development and function,Mr Yew Ann Leong,2018,,"['Basic Science', 'obesity | metabolic syndrome | sympathetic nervous system | lymph node | innate immunity']",408768.0,NHMRC,2018,False
Monash University,Understanding mechanisms of allostery and biased agonism at the adenosine A1 receptor,Prof Arthur Christopoulos,2015,2017.0,"['Basic Pharmacology', 'MEDICAL AND HEALTH SCIENCES', 'PHARMACOLOGY AND PHARMACEUTICAL SCIENCES', 'adenosine receptors', 'G protein-coupled receptors', 'signal transduction', 'structure-function', 'drug discovery']",603033.0,NHMRC,2015,False
Monash University,An exploration of the nature and meaning of informal communities in cancer treatment,Dr Matthew Grant,2018,,"['Health Services Research', 'psycho-oncology | sociology | communications/social research | community | social support networks']",91455.0,NHMRC,2018,False
Monash University,Electrical stimulation of the brain for restoring vision,Prof Jeffrey Rosenfeld,2016,2019.0,"['Medical Devices', 'ENGINEERING', 'BIOMEDICAL ENGINEERING', 'artificial neural networks', 'blindness', 'brain', 'clinical trial', 'implants', 'low vision', 'visual cortex', 'sight', 'optics']",1555864.6,NHMRC,2016,False
Monash University,Bacterial and Host Drivers of Fulminant Community-acquired Acinetobacter baumannii Infection,Prof Anton Peleg,2018,,"['Basic Science', 'bacterial pathogenesis | virulence | innate immunity | pneumonia | zebrafish']",729315.0,NHMRC,2018,False
Monash University,First Seizure Management in Australia,Dr Emma Foster,2018,,"['Clinical Medicine and Science', 'seizures | epilepsy | emergency medicine | quality of life | evidence-based clinical practice']",126437.0,NHMRC,2018,False
Monash University,Acute traumatic coagulopathy- mechanisms and measurement,Prof Biswadev Mitra,2014,2017.0,"['Emergency Medicine', 'MEDICAL AND HEALTH SCIENCES', 'CLINICAL SCIENCES', 'trauma', 'traumatic injury', 'blood', 'blood transfusion', 'resuscitation', 'emergency medicine', 'coagulation', 'coagulation disorders']",188226.95,NHMRC,2014,False
Monash University,Clinical effectiveness of aspirin in healing chronic venous leg ulcers: a randomised double-blinded placebo-controlled trial,Prof Carolina Weller,2014,2018.0,"['Aged Care Nursing', 'MEDICAL AND HEALTH SCIENCES', 'NURSING', 'venous leg ulcers', 'treatment evaluation', 'adherence', 'adjuvant therapy', 'ageing population', 'wound healing', 'randomised controlled trial (RCT)']",791980.75,NHMRC,2014,False
Monash University,The role of immune cells and the transcription factor Hmga1 in boosting neural regeneration,Dr Jan Kaslin,2014,2016.0,"['Developmental Genetics (incl. Sex Determination)', 'BIOLOGICAL SCIENCES', 'GENETICS', 'zebrafish', 'neuroinflammation', 'regeneration', 'developmental biology', 'inflammation', 'neural development', 'neurogenesis']",375561.53,NHMRC,2014,False
Monash University,"Predicting treatment response to onabotulinumtoxin-a in MS-related tremor: a combined clinical, electrophysiological and neuroimaging approach.",,2015,2019.0,"['Central Nervous System', 'MEDICAL AND HEALTH SCIENCES', 'NEUROSCIENCES', 'multiple sclerosis (MS)', 'tremor', 'botulinum toxin', 'neurophysiology', 'outcome measures']",546359.75,NHMRC,2015,False
Monash University,Muscle fusion defects may be a common cause of human dystrophies,Prof Christophe Marcelle,2014,2016.0,"['Developmental Genetics (incl. Sex Determination)', 'BIOLOGICAL SCIENCES', 'GENETICS', 'dystrophy', 'muscle development', 'muscle disease', 'embryonic development', 'muscle function']",391419.12,NHMRC,2014,False
Monash University,An integrated virtual cell approach towards elucidating the systems pharmacology of antibiotics against Pseudomonas aeruginosa,Prof Jian Li,2017,2020.0,"['Pharmacology and Pharmaceutical Sciences not elsewhere classified', 'MEDICAL AND HEALTH SCIENCES', 'PHARMACOLOGY AND PHARMACEUTICAL SCIENCES', 'antimicrobial resistance', 'pharmacology', 'metabolomics', 'systems biology', 'modelling']",844668.2,NHMRC,2017,False
Monash University,"Development and Epilepsy - Strategies for Innovative Research to improve diagnosis, prevention and treatment in children with difficult to treat Epilepsy",Prof Assam El-Osta,2014,2017.0,"['Neurosciences not elsewhere classified', 'MEDICAL AND HEALTH SCIENCES', 'NEUROSCIENCES', 'brain abnormalities', 'epilepsy', 'brain disease', 'drug resistant', 'epigenetics']",456083.56,NHMRC,2014,False
Monash University,A randomised trial of allowing men who have sex with men to have HIV and syphilis tests between clinic consultations.,Dr Tim Read,2015,2019.0,"['Epidemiology', 'MEDICAL AND HEALTH SCIENCES', 'PUBLIC HEALTH AND HEALTH SERVICES', 'syphilis', 'human immunodeficiency virus (HIV)', 'prevention', 'access to health care', 'randomised controlled trial (RCT)']",381414.25,NHMRC,2015,False
Monash University,Using direct reprogramming to generate and rejuvenate haematopoietic stem cells,Prof Jose Polo,2016,,"['Basic Science', 'haematopoietic stem cells | regenerative medicine | stem cell therapy | cell biology | stem cells']",1026313.0,NHMRC,2016,False
Monash University,Research in evidence synthesis,Dr Joanne McKenzie,2014,,"['Public Health', 'evidence-based health care | meta-analysis | randomised controlled trial (rct) | evidence-based | statistics | clinical practice | mental health | health services research']",304596.0,NHMRC,2014,False
Monash University,Improving access to safe water using Riverbank Filtration Technology,Prof Karin Leder,2015,,"['Public Health', 'water supply | water quality | water-borne diseases | diarrhoeal disease | india']",1021398.0,NHMRC,2015,False
Monash University,Small molecule therapeutics: from infectious and parasitic diseases to cancers,Prof Jonathan Baell,2017,,"['Basic Science', 'drug discovery | drug development | drug design | medicinal chemistry | protozoan parasitic disease']",763845.0,NHMRC,2017,False
Monash University,PIPS regulate the type 1 angiotensin receptor,Prof Marie-Isabel Aguilar,2015,2017.0,"['110204', 'G protein-coupled receptors', 'angiotensin receptor', 'molecular pharmacology', 'membranes', 'biophysics']",608123.0,NHMRC,2015,False
Monash University,INHIBITORS OF DENGUE VIRUS NONSTRUCTURAL PROTEIN 5 NUCLEAR TRAFFICKING AS PROBES OF DENGUE BIOLOGY,Prof David Jans,2014,2017.0,"['Protein Trafficking', 'BIOLOGICAL SCIENCES', 'BIOCHEMISTRY AND CELL BIOLOGY', 'trafficking', 'infection', 'dengue virus', 'virology', 'antibody']",741136.2,NHMRC,2014,False
Monash University,Towards Prevention of Acute Kidney Injury after Cardiac Surgery,Prof Roger Evans,2017,,"['Basic Science', 'renal medulla | renal failure | cardiopulmonary bypass | renal physiology | mathematical modelling']",771918.0,NHMRC,2017,False
Monash University,Generation of human intestinal stem cells by direct reprogramming,Dr Christian Nefzger,2018,,"['Basic Science', 'intestinal | stem cells | pluripotential | in vitro | ageing']",621688.0,NHMRC,2018,False
Monash University,Post-stroke hyperglycaemia – Treatment with Exenatide in Acute Ischaemic Stroke (TEXAIS) trial,Prof Christopher Bladin,2017,2019.0,"['Central Nervous System', 'MEDICAL AND HEALTH SCIENCES', 'NEUROSCIENCES', 'hyperglycaemia', 'stroke', 'stroke outcome', 'diabetes', 'glucose metabolism']",1295710.1,NHMRC,2017,False
Monash University,Efficacy of high volume injections compared to placebo following failure of conservative therapy for Achilles tendinopathy,,2019,,"['Clinical Medicine and Science', 'musculoskeletal disorders | tendon injury | rheumatology | radiology | musculoskeletal']",574323.0,NHMRC,2019,False
Monash University,The OPTIMISE project: Collaborative improvement of primary health care delivery to the Australian refugee community,Prof Grant Russell,2016,2020.0,"['Primary Health Care', 'MEDICAL AND HEALTH SCIENCES', 'PUBLIC HEALTH AND HEALTH SERVICES', 'randomised trial', 'evidence-based clinical practice', 'refugee health', 'primary care', 'health care delivery']",1053913.9,NHMRC,2016,False
Monash University,Fathoming sleep depth: a novel approach to the understanding and assessing of sleep-state misperception in insomnia,Dr Thomas Andrillon,2020,,"['Clinical Medicine and Science', 'insomnia | sleep disturbance | physiology | arousal | diagnosis']",327192.0,NHMRC,2020,False
Monash University,Effective therapies to treat viral infections and their complications in transplantation,Prof Mariapia Degli-Esposti,2017,,"['Basic Science', 'viral immunity | bone marrow transplantation | cytomegalovirus (cmv) infection | immunotherapy | viral persistence']",1100450.0,NHMRC,2017,False
Monash University,Improving outcomes in patients with community-acquired severe sepsis: The role of pre-hospital antibiotics.,Prof Andrew Udy,2017,,"['Clinical Medicine and Science', 'sepsis | emergency medicine | infectious diseases | outcomes research | clinical trial']",265138.0,NHMRC,2017,False
Monash University,Improving outcomes in obstructive sleep apnoea through individualised treatment of physiological abnormalities,Dr Simon Joosten,2018,,"['Clinical Medicine and Science', 'obstructive sleep apnoea | respiratory control | upper airway physiology | treatment strategies | treatment efficacy']",340891.0,NHMRC,2018,False
Monash University,Generation of human intestinal stem cells by direct reprogramming,Dr Christian Nefzger,2018,2020.0,"['Regenerative Medicine (incl. Stem Cells and Tissue Engineering)', 'TECHNOLOGY', 'MEDICAL BIOTECHNOLOGY', 'intestinal', 'stem cells', 'pluripotential', 'in vitro', 'ageing']",630391.6,NHMRC,2018,False
Monash University,Eye movements and the neural representation of visual space,Dr Adam Morris,2015,,"['Basic Science', 'vision | cerebral cortex | electrophysiology | eye movements | spatial neglect']",445106.0,NHMRC,2015,False
Monash University,Topical drug delivery based on porous silicon nanoneedles,Dr Maria Alba Martin,2017,,"['Basic Science', 'skin cancer | drug delivery systems | skin permeability | nanotechnology | epidermal barrier']",318768.0,NHMRC,2017,False
Monash University,Investigation of the role of PI3-kinase in the regulation of angiogenesis,Prof Christina Mitchell,2016,2019.0,"['Signal Transduction', 'BIOLOGICAL SCIENCES', 'BIOCHEMISTRY AND CELL BIOLOGY', 'angiogenesis', 'tumour biology', 'signalling pathways', 'phosphoinositide 3-kinase', 'mouse models']",864209.06,NHMRC,2016,False
Monash University,Novel treatments of fibrosis for hypertensive heart disease,Prof Robert Widdop,2017,2020.0,"['Basic Pharmacology', 'MEDICAL AND HEALTH SCIENCES', 'PHARMACOLOGY AND PHARMACEUTICAL SCIENCES', 'angiotensin', 'angiotensin receptor', 'drug discovery', 'fibrosis', 'peptides']",935080.56,NHMRC,2017,False
Monash University,The Persisting Vascular Effects of Activation of the Renin-Angiotensin System,Prof Merlin Thomas,2016,2018.0,"['Cardiology (incl. Cardiovascular Diseases)', 'MEDICAL AND HEALTH SCIENCES', 'CARDIORESPIRATORY MEDICINE AND HAEMATOLOGY', 'renin-angiotensin system (RAS)', 'angiotensin', 'atherosclerosis', 'epigenetics', 'atherogenesis']",646694.75,NHMRC,2016,False
Monash University,Uncovering the molecular mechanisms behind Charcot-Marie-Tooth disease,Dr Brent Neumann,2016,2018.0,"['Cellular Nervous System', 'MEDICAL AND HEALTH SCIENCES', 'NEUROSCIENCES', 'Charcot-Marie-Tooth disease', 'molecular neuroscience', 'molecular basis of disease', 'mitochondrial dynamics', 'axonal degeneration']",330038.28,NHMRC,2016,False
Monash University,A Double Blind Randomised Placebo Controlled Trial of Melatonin as an Adjuvant Agent in Induction of Labour,Dr Miranda Davies-Tuck,2017,2019.0,"['Obstetrics and Gynaecology', 'MEDICAL AND HEALTH SCIENCES', 'PAEDIATRICS AND REPRODUCTIVE MEDICINE', 'clinical trial', 'induction of labour', 'labour', 'melatonin', 'caesarean section']",393384.38,NHMRC,2017,False
Monash University,Identification of factors critical for maintenance of the epidermal barrier,Prof Stephen Jane,2016,,"['Basic Science', 'epidermal barrier | skin permeability | transcriptional regulation | gene disruption | atopic dermatitis']",616950.0,NHMRC,2016,False
Monash University,Harnessing RNA interference in gene therapy vectors for β-thalassaemia,,2018,,"['Basic Science', 'thalassaemia | gene therapy | lentiviral vector | rna interference | mouse models']",709259.0,NHMRC,2018,False
Monash University,Developmental Switches in Spermatogenesis,Prof Katherine Loveland,2015,,"['Basic Science', 'spermatogenesis | testicular cancer | activin | cell signalling | testis development']",675810.0,NHMRC,2015,False
Monash University,The role of Clostridium difficile spore interactions with the host in gastrointestinal infection and disease,Prof Dena Lyras,2016,2018.0,"['Medical Bacteriology', 'MEDICAL AND HEALTH SCIENCES', 'MEDICAL MICROBIOLOGY', 'bacterial gastroenteritis', 'bacterial infection', 'bacterial pathogenicity', 'bacterial pathogenesis', 'bacterial pathogen']",525993.0,NHMRC,2016,False
Monash University,Diversification of immune responses through unanticipated proteolytic mechanisms,,2019,,"['Basic Science', 'mass spectrometry | antigen presentation | antigen processing | t cell epitope | t cell immunity']",922284.0,NHMRC,2019,False
Monash University,Physiologic and aberrant DNA recombination in B lymphocytes,Mr Ervin Kara,2017,,"['Basic Science', 'b cells | lymphoma | somatic mutation | recombination | cytotoxic t lymphocytes (ctl)']",408768.0,NHMRC,2017,False
Monash University,Prevalence of Genital HPV Infection in Males Following Introduction of Universal Male HPV Vaccination,,2015,2018.0,"['Preventive Medicine', 'MEDICAL AND HEALTH SCIENCES', 'PUBLIC HEALTH AND HEALTH SERVICES', 'human papillomavirus (HPV)', 'vaccination', 'male', 'Australia', 'immunisation']",320891.38,NHMRC,2015,False
Monash University,Why is the hijacking of a human erythrocyte signalling pathway essential for malaria infection?,Prof Christian Doerig,2015,,"['Basic Science', 'signalling pathways | kinases | kinase inhibitors | malaria | host/pathogen interaction']",495106.0,NHMRC,2015,False
Monash University,Host-pathogen interactions in clostridial myonecrosis,Prof Julian Rood,2015,2018.0,"['Medical Bacteriology', 'MEDICAL AND HEALTH SCIENCES', 'MEDICAL MICROBIOLOGY', 'clostridial myonecrosis', 'pathogenesis', 'host/pathogen interaction', 'virulence', 'innate immunity']",897617.0,NHMRC,2015,False
Monash University,Defining the epigenetic origins of maternally inherited disease.,Dr Patrick Western,2018,2020.0,"['Epigenetics (incl. Genome Methylation and Epigenomics)', 'BIOLOGICAL SCIENCES', 'GENETICS', 'oocyte', 'inheritance', 'growth disorders', 'fetal origins of disease', 'cognitive disorders']",741398.25,NHMRC,2018,False
Monash University,An integrated virtual cell approach towards elucidating the systems pharmacology of antibiotics against Pseudomonas aeruginosa,Prof Jian Li,2017,,"['Basic Science', 'antimicrobial resistance | pharmacology | metabolomics | systems biology | modelling']",823718.0,NHMRC,2017,False
Monash University,Improving pregnancy care for populations at risk in Australia,,2016,2019.0,"['Preventive Medicine', 'MEDICAL AND HEALTH SCIENCES', 'PUBLIC HEALTH AND HEALTH SERVICES', 'pregnancy', 'maternal health', 'Aboriginal health', 'polycystic ovarian syndrome (PCOS)', 'refugee health']",324026.72,NHMRC,2016,False
Monash University,Interactive attention training technology to enhance cognitive skills in early life,Prof Kim Cornish,2018,,"['Clinical Medicine and Science', 'attention deficits | early childhood | training | cognitive development | acquired brain injury']",759680.0,NHMRC,2018,False
Monash University,The Persisting Vascular Effects of Activation of the Renin-Angiotensin System,Prof Merlin Thomas,2016,,"['Basic Science', 'renin-angiotensin system (ras) | angiotensin | atherosclerosis | epigenetics | atherogenesis']",628456.0,NHMRC,2016,False
Monash University,Characterisation of autophagy deficiency in skeletal muscle homeostasis,Prof Christina Mitchell,2015,2019.0,"['Signal Transduction', 'BIOLOGICAL SCIENCES', 'BIOCHEMISTRY AND CELL BIOLOGY', 'phosphoinositide 3-kinase', 'autophagy', 'skeletal muscle', 'obesity', 'insulin signalling']",956237.25,NHMRC,2015,False
Monash University,Understanding the physiological advantage behind delayed cord clamping.,A/Pr Graeme Polglase,2014,2016.0,"['Obstetrics and Gynaecology', 'MEDICAL AND HEALTH SCIENCES', 'PAEDIATRICS AND REPRODUCTIVE MEDICINE', 'premature birth', 'cardiovascular physiology', 'cardiovascular risk factors', 'brain injury', 'ventilation', 'premature infant', 'cerebral blood flow']",647539.9,NHMRC,2014,False
Monash University,Enhancing vaccine efficacy by harnessing dendritic cell receptors and their unique properties,A/Pr Irina Caminschi,2014,2016.0,"['Cellular Immunology', 'MEDICAL AND HEALTH SCIENCES', 'IMMUNOLOGY', 'dendritic cell', 'vaccination immunology', 'cell surface receptor', 'immune response', 'immunisation', 'lectins']",687519.8,NHMRC,2014,False
Monash University,Design and engineering of adnectins for diagnosis and therapy,A/Pr Ashley Buckle,2017,,"['Basic Science', 'protein engineering | protein biochemistry | protein interactions | novel therapeutic agents | molecular evolution']",803152.0,NHMRC,2017,False
Monash University,Melatonin as an adjuvant therapy in preeclampsia,Prof Euan Wallace,2014,2016.0,"['Obstetrics and Gynaecology', 'MEDICAL AND HEALTH SCIENCES', 'PAEDIATRICS AND REPRODUCTIVE MEDICINE', 'pre-eclampsia', 'oxidative stress', 'placenta', 'pregnancy complications', 'melatonin', 'fetus']",433750.03,NHMRC,2014,False
Monash University,Health and fertility of young men conceived using intra-cytoplasmic sperm injection,Prof Robert McLachlan,2017,,"['Clinical Medicine and Science', 'assisted reproductive technology (art) | young adults | fertility | genetic influences | disease susceptibility']",362570.0,NHMRC,2017,False
Monash University,Treatment of invasively ventilated adults with Early Activity and Mobilisation,A/Pr Carol Hodgson,2017,,"['Clinical Medicine and Science', 'randomised controlled trial (rct) | intensive care | critical illness | mobility | physiotherapy']",1467137.0,NHMRC,2017,False
Monash University,Investigation of the role of PI3-kinase in the regulation of angiogenesis,Prof Christina Mitchell,2016,,"['Basic Science', 'angiogenesis | tumour biology | signalling pathways | phosphoinositide 3-kinase | mouse models']",837660.0,NHMRC,2016,False
Monash University,Roles of the EMT transcription factors in epigenetic remodelling and myeloid cell transformation.,A/Pr Jody Haigh,2018,,"['Clinical Medicine and Science', 'leukaemia | transcription factor | epigenetics | myeloid leukaemia | mouse models']",809520.0,NHMRC,2018,False
Monash University,Cannabidiol may protect the brain against the harmful effects of marijuana,Prof Murat Yucel,2018,,"['Clinical Medicine and Science', 'cannabis | hippocampus | neuroprotection | brain imaging | substance misuse']",974586.0,NHMRC,2018,False
Monash University,How the kidney is injured by CD8+ cells in vasculitis,Prof Arthur Kitching,2015,2018.0,"['Nephrology and Urology', 'MEDICAL AND HEALTH SCIENCES', 'CLINICAL SCIENCES', 'kidney disease', 'glomerulonephritis', 'vasculitis', 'lymphocytes', 'myeloperoxidase']",928780.7,NHMRC,2015,False
Monash University,Maximising the usefulness and timeliness of trauma and emergency registry data for improving patient outcomes,Dr Gerard O'Reilly,2018,,"['Clinical Medicine and Science', 'injury | injury epidemiology | emergency medicine | epidemiology | quality improvement']",189384.0,NHMRC,2018,False
Monash University,Effective cognitive aids for clinical emergencies,,2017,2020.0,"['Industrial and Organisational Psychology', 'PSYCHOLOGY AND COGNITIVE SCIENCES', 'PSYCHOLOGY', 'anaesthesia', 'decision support', 'emergency medicine', 'design', 'psychology']",193065.84,NHMRC,2017,False
Monash University,The molecular basis by which the interleukin-6 cytokine promotes emphysema,Prof Brendan Jenkins,2015,2017.0,"['Signal Transduction', 'BIOLOGICAL SCIENCES', 'BIOCHEMISTRY AND CELL BIOLOGY', 'emphysema', 'interleukin-6 (IL-6)', 'cytokine signalling', 'mouse models', 'inflammation']",659457.1,NHMRC,2015,False
Monash University,Antigen-specific regulatory T cells and HLA associations in autoimmune renal disease,,2018,2021.0,"['Nephrology and Urology', 'MEDICAL AND HEALTH SCIENCES', 'CLINICAL SCIENCES', 'glomerulonephritis', 'kidney failure', 'human leukocyte antigen (HLA)', 'autoimmunity', 'regulatory T cells']",128224.82,NHMRC,2018,False
Monash University,Anti-sporulation strategies for Clostridium difficile infections,Prof Dena Lyras,2018,2020.0,"['Medical Bacteriology', 'MEDICAL AND HEALTH SCIENCES', 'MEDICAL MICROBIOLOGY', 'infection', 'pathogenic bacteria', 'gastrointestinal infections', 'infection control', 'infectious diseases']",660680.8,NHMRC,2018,False
