institutions,title,principalInvestigator,startDate,endDate,subjects,fundingAmount,funder,startDate_clean,surrounded_by_square_brackets
Monash University,Determining the cost-effectiveness of a novel Australian Stroke Telemedicine program: CAST study,Prof Dominique Cadilhac,2015,,"['Health Services Research', 'stroke | telemedicine | economic evaluation | hospitals | health care delivery']",475446.0,NHMRC,2015,False
Monash University,Architecture of the Hendra virus nucleocapsid and implications for replication,A/Pr Fasseli Coulibaly,2015,2017.0,"['Medical Virology', 'MEDICAL AND HEALTH SCIENCES', 'MEDICAL MICROBIOLOGY', 'virology', 'replication', 'electron microscopy', 'crystallography', 'structural biology']",342108.28,NHMRC,2015,False
Monash University,Defining the Physiology and Therapeutic Potential of Inhibin,,2019,,"['Basic Science', 'menopause | ovarian function | bone disease | activin and inhibin | endocrinology']",672521.0,NHMRC,2019,False
Monash University,Brain Oxygen Neuromonitoring In Australia And New Zealand Assessment (BONANZA) Trial,,2020,,"['Clinical Medicine and Science', 'randomised controlled trial (rct) | brain injury | monitoring | mortality | outcome']",2703830.0,NHMRC,2020,False
Monash University,Modulating inflammation as a therapy for Harlequin Ichthyosis,Prof Ian Smyth,2017,,"['Basic Science', 'skin disease | lipid disorders | inflammation | skin permeability | keratinocytes']",718739.0,NHMRC,2017,False
Monash University,CLINICAL STUDIES TOWARDS A CURE FOR HIV,,2018,2020.0,"['Infectious Diseases', 'MEDICAL AND HEALTH SCIENCES', 'CLINICAL SCIENCES', 'human immunodeficiency virus (HIV)', 'clinical trial', 'social and behavioural research', 'perceived needs', 'immune modulation']",128224.82,NHMRC,2018,False
Monash University,The pulvinar is instrumental in the development of visual cortical networks,A/Pr James Bourne,2018,2021.0,"['Sensory Systems', 'MEDICAL AND HEALTH SCIENCES', 'NEUROSCIENCES', 'thalamus', 'visual cortex', 'monkey', 'development', 'plasticity']",1209611.8,NHMRC,2018,False
Monash University,Improving Global Tuberculosis Control with the AuTuMN Platform,Dr James Trauer,2018,2020.0,"['Epidemiology', 'MEDICAL AND HEALTH SCIENCES', 'PUBLIC HEALTH AND HEALTH SERVICES', 'computer simulation', 'epidemiology', 'tuberculosis', 'computer-based decision support', 'communicable disease']",664229.8,NHMRC,2018,False
Monash University,Evidence Innovation: transforming the efficiency of systematic review,A/Pr Julian Elliott,2016,2018.0,"['Medical and Health Sciences not elsewhere classified', 'MEDICAL AND HEALTH SCIENCES', 'OTHER MEDICAL AND HEALTH SCIENCES', 'meta-analysis', 'knowledge', 'information science/medical informatics', 'translation', 'efficiency']",957856.75,NHMRC,2016,False
Monash University,Molecular determinants of drug binding and selectivity at muscarinic acetylcholine receptors,Dr David Thal,2018,,"['Basic Science', 'g protein-coupled receptors | muscarinic receptors | x-ray crystallography | structural biology | drug discovery']",816866.0,NHMRC,2018,False
Monash University,Characterisation of autophagy deficiency in skeletal muscle homeostasis,Prof Christina Mitchell,2015,,"['Basic Science', 'phosphoinositide 3-kinase | autophagy | skeletal muscle | obesity | insulin signalling']",916231.0,NHMRC,2015,False
Monash University,Developing Irreversible Electroporation Non-Thermal Tumor Ablation for Organ-Confined Prostate Cancer Treatment,Prof Kenneth Thomson,2015,,"['Clinical Medicine and Science', 'prostate cancer | therapy | targeted therapy | solid tumours | dose optimisation']",281746.0,NHMRC,2015,False
Monash University,Physiological consequences of the loss of inhibin activity,A/Pr Craig Harrison,2015,2017.0,"['Paediatrics and Reproductive Medicine not elsewhere classified', 'MEDICAL AND HEALTH SCIENCES', 'PAEDIATRICS AND REPRODUCTIVE MEDICINE', 'activin and inhibin', 'transforming growth factor beta (TGF-beta)', 'female menopause', 'muscle wasting', 'bone loss']",613035.06,NHMRC,2015,False
Monash University,The role of sleep disturbances in the development of trauma-related mental health disorders in paramedics,Dr Alexander Wolkow,2018,,"['Clinical Medicine and Science', 'sleep disturbance | emergency medical service | mental health | stress response | posttraumatic stress disorder (ptsd)']",318768.0,NHMRC,2018,False
Monash University,Codon bias: a hidden layer of translational regulation by estrogens,Dr Luc Furic,2018,2020.0,"['Biochemistry and Cell Biology not elsewhere classified', 'BIOLOGICAL SCIENCES', 'BIOCHEMISTRY AND CELL BIOLOGY', 'RNA metabolism', 'hormone receptors', 'protein synthesis', 'proliferation', 'signalling pathways']",426815.12,NHMRC,2018,False
Monash University,The structural basis for biased agonism at the glucagon-like peptide-1 receptor,,2017,2020.0,"['Basic Pharmacology', 'MEDICAL AND HEALTH SCIENCES', 'PHARMACOLOGY AND PHARMACEUTICAL SCIENCES', 'G protein-coupled receptors', 'receptor signalling', 'structure-function', 'mutagenesis', 'receptor dimerisation']",894094.7,NHMRC,2017,False
Monash University,Understanding the genetics of blood cells and blood cell disorders,Prof Benjamin Kile,2014,,"['Basic Science', 'haematopoiesis | myeloid | platelets | stem cell biology | leukaemogenesis | inflammation']",727610.0,NHMRC,2014,False
Monash University,Trial to Evaluate Anti-fibrinolytic Therapy in Thrombocytopenia (TREATT),A/Pr Erica Wood,2015,2019.0,"['Haematology', 'MEDICAL AND HEALTH SCIENCES', 'CARDIORESPIRATORY MEDICINE AND HAEMATOLOGY', 'haematological malignancy', 'blood transfusion', 'platelets', 'cancer treatment', 'supportive care']",1057478.5,NHMRC,2015,False
Monash University,What makes a cell pluripotent?,Dr Anja Knaupp,2015,,"['Basic Science', 'regenerative medicine | stem cell therapy | stem cell biology | biochemistry | gene regulation']",309436.0,NHMRC,2015,False
Monash University,Identifying Novel Molecular Targets for Treating Chronic Pain.,Dr Wendy Imlach,2018,,"['Basic Science', 'neuropharmacology | neuropathic pain | molecular markers | receptor regulation | spinal cord']",402952.0,NHMRC,2018,False
Monash University,Bacterial metabolite mediated regulation of the immune and metabolic systems,Prof Charles Mackay,2018,2020.0,"['Medical and Health Sciences not elsewhere classified', 'MEDICAL AND HEALTH SCIENCES', 'OTHER MEDICAL AND HEALTH SCIENCES', 'metabolism', 'metabolic syndrome', 'inflammation', 'dendritic cell lineages', 'epigenetics']",303374.1,NHMRC,2018,False
Monash University,Cytoprotective and metabolic responses to biased agonists acting at cardiomyocyte Gq-coupled receptors,Dr Masaaki Sato,2017,2019.0,"['Basic Pharmacology', 'MEDICAL AND HEALTH SCIENCES', 'PHARMACOLOGY AND PHARMACEUTICAL SCIENCES', 'cardiomyocytes', 'G protein-coupled receptors', 'receptor signalling', 'ischaemic heart disease', 'cardioprotection']",740629.25,NHMRC,2017,False
Monash University,Host-pathogen interactions in clostridial myonecrosis,Prof Julian Rood,2015,,"['Basic Science', 'clostridial myonecrosis | pathogenesis | host/pathogen interaction | virulence | innate immunity']",862693.0,NHMRC,2015,False
Monash University,Optimizing the differentiation and expansion of microglial progenitors from human pluripotent stem cells for the study and treatment of neurological disease,Prof Colin Pouton,2015,2018.0,['MEDICAL AND HEALTH SCIENCES'],915719.25,NHMRC,2015,False
Monash University,Systems-level Characterisation and Therapeutic Targeting of small RNAs in Acinetobacter baumannii disease,Prof Anton Peleg,2017,,"['Basic Science', 'bacterial pathogenesis | virulence | mechanisms | rna | antimicrobial therapy']",581990.0,NHMRC,2017,False
Monash University,"An interdisciplinary model of care for early detection of lung damage, smoking cessation support, and a home-based exercise/self-management program",Dr Johnson George,2014,,"['Health Services Research', 'chronic obstructive pulmonary disease (copd) | smoking cessation | rehabilitation services | screening | multidisciplinary | guidelines']",441491.0,NHMRC,2014,False
Monash University,The role of NOX4 in muscle antioxidant defence and mitochondrial biogenesis,,2019,,"['Basic Science', 'reactive oxygen species (ros) | protein tyrosine phosphatase (ptp) | skeletal muscle | insulin resistance | mitochondria']",820985.0,NHMRC,2019,False
Monash University,Host cell death signaling and susceptibility to bacterial gut infection,,2018,2020.0,"['Medical Bacteriology', 'MEDICAL AND HEALTH SCIENCES', 'MEDICAL MICROBIOLOGY', 'death signalling', 'inflammatory bowel disease (IBD)', 'pathogenic bacteria', 'inflammation', 'gut immunity']",691873.7,NHMRC,2018,False
Monash University,A Partnership for Evidence-Based Resource Allocation and Enhanced Research Translation in Allied Health,Prof Terrence Haines,2015,,"['Health Services Research', 'translational research | evidence-based health care | allied health | health economics | decision support techniques']",616780.0,NHMRC,2015,False
Monash University,A novel treatment for ischemic stroke: preclinical assessment in the nonhuman primate,A/Pr James Bourne,2015,2018.0,"['Central Nervous System', 'MEDICAL AND HEALTH SCIENCES', 'NEUROSCIENCES', 'ischaemia', 'primate', 'neocortex', 'regeneration', 'neural regeneration']",762246.2,NHMRC,2015,False
Monash University,Diabetes target discovery and drug development in mice and primates,Prof Michael Cowley,2015,2019.0,"['Autonomic Nervous System', 'MEDICAL AND HEALTH SCIENCES', 'NEUROSCIENCES', 'diabetes', 'pro-opiomelanocortin (POMC)', 'leptin', 'physiology', 'sympathetic nervous system']",705501.1,NHMRC,2015,False
Monash University,Understanding the impact of epigenetic gene regulation on Helicobacter pylori persistence and pathogenesis.,Dr Yogitha Srikhanta,2018,,"['Basic Science', 'epigenetics | bacterial pathogenesis | virulence factors | phase variation | helicobacter pylori']",757896.0,NHMRC,2018,False
Monash University,The molecular basis of HLA-linked drug hypersensitivity,Prof Anthony Purcell,2017,2020.0,"['Cellular Immunology', 'MEDICAL AND HEALTH SCIENCES', 'IMMUNOLOGY', 'mass spectrometry', 'human leukocyte antigen (HLA)', 'T cell response', 'antigen presentation', 'hypersensitivity']",848038.75,NHMRC,2017,False
Monash University,Endogenous oestrogen is a key missing link in urethral hypospadias,Prof Gail Risbridger,2016,2018.0,"['Paediatrics and Reproductive Medicine not elsewhere classified', 'MEDICAL AND HEALTH SCIENCES', 'PAEDIATRICS AND REPRODUCTIVE MEDICINE', 'developmental biology', 'reproductive disorders', 'reproductive biology', 'oestrogen action', 'hypospadias']",469367.28,NHMRC,2016,False
Monash University,Investigating the impact of coincident modulation of adenosine and glutamate receptors on neuronal activity – implications for CNS drug discovery,Dr Karen Gregory,2017,2019.0,"['Basic Pharmacology', 'MEDICAL AND HEALTH SCIENCES', 'PHARMACOLOGY AND PHARMACEUTICAL SCIENCES', 'cognitive disorders', 'adenosine receptors', 'glutamate receptors', 'receptor dimerisation', 'signalling pathways']",663662.2,NHMRC,2017,False
Monash University,"Type 2 immunity: a regulator of physiology, tissue repair and metabolism",,2018,2022.0,"['Immunology not elsewhere classified', 'MEDICAL AND HEALTH SCIENCES', 'IMMUNOLOGY', 'intestine', 'helminth infection', 'immunology', 'obesity', 'repair']",649172.94,NHMRC,2018,False
Monash University,IV iron for Treatment of Anaemia before Cardiac Surgery (ITACS Trial),Prof Paul Myles,2016,,"['Clinical Medicine and Science', 'cardiac surgery | anaesthesia | transfusion | anaemia | outcomes research']",2285290.0,NHMRC,2016,False
Monash University,Enhancing aspects of time-to-event analysis methodology in randomised trials,Prof Rory Wolfe,2017,,"['Public Health', 'biostatistics | melanoma | public health | methodology | epidemiology']",548446.0,NHMRC,2017,False
Monash University,Therapeutic targeting of the colorectal cancer epigenome,A/Pr Ron Firestein,2018,,"['Basic Science', 'rna | genomics | enhancer elements | cancer biology | colon cancer']",537045.0,NHMRC,2018,False
Monash University,Developing new therapeutic strategies for brain cancer,Prof Terrance Johns,2017,2021.0,"['Cancer Therapy (excl. Chemotherapy and Radiation Therapy)', 'MEDICAL AND HEALTH SCIENCES', 'ONCOLOGY AND CARCINOGENESIS', 'targeted therapy', 'brain tumours', 'receptor tyrosine kinase (RTK)', 'signalling pathways', 'ectopic pregnancy']",783213.7,NHMRC,2017,False
Monash University,NOVEL SOLUTIONS FOR ANTIMICROBIAL RESISTANT PATHOGENS,Prof Anton Peleg,2017,,"['Basic Science', 'antibiotic resistance | bacterial pathogenesis | staphylococcus aureus | biofilm | candida']",474513.0,NHMRC,2017,False
Monash University,Improving outcomes in obstructive sleep apnoea through individualised treatment of physiological abnormalities,Dr Simon Joosten,2018,2021.0,"['Respiratory Diseases', 'MEDICAL AND HEALTH SCIENCES', 'CARDIORESPIRATORY MEDICINE AND HAEMATOLOGY', 'obstructive sleep apnoea', 'respiratory control', 'upper airway physiology', 'treatment strategies', 'treatment efficacy']",271035.3,NHMRC,2018,False
Monash University,Risk Prediction for Surgical Site Infections following Prosthetic Joint Replacement Surgery,Dr Trisha Peel,2014,2017.0,"['Infectious Diseases', 'MEDICAL AND HEALTH SCIENCES', 'CLINICAL SCIENCES', 'orthopaedic surgery', 'nosocomial infections', 'surgical outcomes research', 'prevention', 'risk prediction']",376449.66,NHMRC,2014,False
Monash University,Hyper-sensitivity of the circadian system to light in Delayed Sleep Phase Disorder,A/Pr Sean Cain,2015,,"['Clinical Medicine and Science', 'sleep disorders | sleep onset | insomnia | circadian rhythms | light sensitivity']",367415.0,NHMRC,2015,False
Monash University,A translational research approach to study mild traumatic brain injury,A/Pr Sandy Shultz,2019,,"['Clinical Medicine and Science', 'concussion | traumatic brain injury (tbi) | magnetic resonance imaging (mri) | neurodegeneration | biomarkers']",483404.0,NHMRC,2019,False
Monash University,"Characterization of novel, colitis associated pathobionts to identify therapeutic targets in the host immune response",,2018,2020.0,"['Innate Immunity', 'MEDICAL AND HEALTH SCIENCES', 'IMMUNOLOGY', 'innate immunity', 'gastrointestinal symptoms', 'bioinformatics', 'colitis', 'cancer immunotherapy']",694193.94,NHMRC,2018,False
Monash University,The link between dopamine and brain circuit dysfunction in early psychosis,Prof Alexander Fornito,2014,,"['Basic Science', 'magnetic resonance imaging (mri) | positron emission tomography (pet) | brain | psychosis | prefrontal cortex | basal ganglia']",828633.0,NHMRC,2014,False
Monash University,Measuring health related social preferences and their inclusion in an alternative method for prioritising health services,Prof Jeff Richardson,2014,2017.0,"['Public Health and Health Services not elsewhere classified', 'MEDICAL AND HEALTH SCIENCES', 'PUBLIC HEALTH AND HEALTH SERVICES', 'economic evaluation', 'consumer preferences', 'resource allocation', 'quality of life', 'cost-effectiveness']",430143.16,NHMRC,2014,False
Monash University,Enhancing the cascade of HIV care to maximise the prevention benefits of antiretroviral therapy for populations living with HIV,Dr James Mcmahon,2016,2019.0,"['Infectious Diseases', 'MEDICAL AND HEALTH SCIENCES', 'CLINICAL SCIENCES', 'human immunodeficiency virus (HIV)', 'antiretroviral therapy', 'clinical outcome', 'surveillance', 'clinical trial']",354026.72,NHMRC,2016,False
Monash University,Defining a role for TLR7/8 in Helicobacter pylori infection,Dr Michael Gantier,2015,,"['Basic Science', 'toll-like receptors | helicobacter pylori | oligonucleotide | bacterial infection | infection control']",546995.0,NHMRC,2015,False
Monash University,Identification of testis-specific markers of male infertility,Dr Peter Stanton,2016,2018.0,"['Reproduction', 'MEDICAL AND HEALTH SCIENCES', 'PAEDIATRICS AND REPRODUCTIVE MEDICINE', 'testis', 'infertility', 'reproductive disorders', 'spermatogenesis', 'proteome analysis']",634302.4,NHMRC,2016,False
Monash University,Dying stem cells as a mechanism of mesenchymal stromal cell therapy,,2019,,"['Basic Science', 'cell therapy | cell death | alveolar macrophages | immune modulation | mechanism of action']",633058.0,NHMRC,2019,False
Monash University,Improving the health of older Australians at risk of dementia - The role of physical function and exercise,Dr Michele Callisaya,2017,,"['Clinical Medicine and Science', 'dementia | cognition | physical health | diabetes mellitus | exercise therapy']",533120.0,NHMRC,2017,False
Monash University,Protein-RNA interactions in antiviral cellular defence and gene regulation,Prof Matthew Wilce,2015,,"['Basic Science', 'rna | messenger rna (mrna) | innate immunity | gene regulation | molecular virology']",675810.0,NHMRC,2015,False
Monash University,Interferon mediated control of Legionella infection,Prof Elizabeth Hartland,2018,2020.0,"['Medical Bacteriology', 'MEDICAL AND HEALTH SCIENCES', 'MEDICAL MICROBIOLOGY', 'pneumonia', 'respiratory infection', 'interferon-gamma (IFN-gamma)', 'legionella', 'intracellular bacterial infections']",637651.9,NHMRC,2018,False
Monash University,Development of Follistatin as Novel Cancer Therapeutic,Prof David Watkins,2017,,"['Clinical Medicine and Science', 'lung cancer | chemotherapy | targeted therapy | drug resistance | endocrinology']",494324.0,NHMRC,2017,False
Monash University,2017 Equipment Grant,Dr Tsharni Zazryn,2017,,['Not Applicable'],708173.0,NHMRC,2017,False
Monash University,Mechanistic and translational studies in female reproductive health,Prof Evdokia Dimitriadis,2017,2021.0,"['Reproduction', 'MEDICAL AND HEALTH SCIENCES', 'PAEDIATRICS AND REPRODUCTIVE MEDICINE', 'endometrium', 'placenta', 'placental insufficiency', 'embryo implantation', 'endometrial cancer']",647379.56,NHMRC,2017,False
Monash University,Targeted Therapeutic Mild Hypercapnia After Resuscitated Cardiac Arrest: A Phase III Multi-Centre Randomised Controlled Trial (The TAME Cardiac Arrest Trial),Prof Stephen Bernard,2017,,"['Clinical Medicine and Science', 'cardiac arrest | intensive care medicine | resuscitation | hypercapnia | mechanical ventilation']",2069878.0,NHMRC,2017,False
Monash University,Improving outcomes in patients with community-acquired severe sepsis: The role of pre-hospital antibiotics.,A/Pr Andrew Udy,2017,2020.0,"['Infectious Diseases', 'MEDICAL AND HEALTH SCIENCES', 'CLINICAL SCIENCES', 'sepsis', 'emergency medicine', 'infectious diseases', 'outcomes research', 'clinical trial']",270292.22,NHMRC,2017,False
Monash University,Skill building interventions to address barriers to social inclusion for people with schizophrenia,Dr Stuart Lee,2016,2019.0,"['Psychiatry (incl. Psychotherapy)', 'MEDICAL AND HEALTH SCIENCES', 'CLINICAL SCIENCES', 'schizophrenia and related disorders', 'remediation', 'cognitive outcome', 'social cognition', 'randomised controlled trial (RCT)']",259221.38,NHMRC,2016,False
Monash University,Understanding and modulating hyperinflammation caused by influenza viruses,Dr Michelle Tate,2017,,"['Basic Science', 'innate immunity | influenza virus | inflammation | immunopathology | pathogenesis']",425048.0,NHMRC,2017,False
Monash University,Centre of Research Excellence in Prehospital Emergency Care,Prof Peter Cameron,2016,,"['Health Services Research', 'emergency medical service | emergency medicine | health services research | health service utilisation | clinical research']",2499626.0,NHMRC,2016,False
Monash University,The Association of Patterns of Dyslipidaemia with Coronary Artery Plaque on Computed Tomography Coronary Angiography,Dr Andrew Lin,2018,,"['Clinical Medicine and Science', 'coronary artery disease | lipids | computed tomography | plaque | atherosclerosis']",126437.0,NHMRC,2018,False
Monash University,"Hepatic oxidative stress, PTPs & STAT signalling in obesity",Prof Tony Tiganis,2015,,"['Basic Science', 'protein tyrosine phosphatase (ptp) | reactive oxygen species (ros) | insulin resistance | insulin signalling | obesity']",1040820.0,NHMRC,2015,False
Monash University,Modulating inflammation as a therapy for Harlequin Ichthyosis,A/Pr Ian Smyth,2017,2019.0,"['Cell Development, Proliferation and Death', 'BIOLOGICAL SCIENCES', 'BIOCHEMISTRY AND CELL BIOLOGY', 'skin disease', 'lipid disorders', 'inflammation', 'skin permeability', 'keratinocytes']",735556.2,NHMRC,2017,False
Monash University,Designing an evidence-based intervention to improve Australian General Practitioners' management of work-related mental health claims,Ms Nabita Singh,2016,2019.0,"['Primary Health Care', 'MEDICAL AND HEALTH SCIENCES', 'PUBLIC HEALTH AND HEALTH SERVICES', 'general practice', 'mental health', 'occupational injury', 'workers compensation', 'primary care']",0.0,NHMRC,2016,False
Monash University,Using Nkx2-5 knock-in mouse models to understand complex cardiac diseases,Dr Mauro Costa,2014,2016.0,"['Cardiology (incl. Cardiovascular Diseases)', 'MEDICAL AND HEALTH SCIENCES', 'CARDIORESPIRATORY MEDICINE AND HAEMATOLOGY', 'transcriptional regulation', 'heart development', 'cardiac dysfunction', 'disease mechanisms', 'mouse genetics']",611340.4,NHMRC,2014,False
Monash University,Glucocorticoid signatures in SLE,,2017,2019.0,"['Autoimmunity', 'MEDICAL AND HEALTH SCIENCES', 'IMMUNOLOGY', 'lupus', 'glucocorticoids', 'expression profiling', 'inflammatory diseases', 'therapeutics']",127629.27,NHMRC,2017,False
Monash University,GPR88 as a novel target for fronto-striatal dysfunction in schizophrenia,,2016,2018.0,"['Central Nervous System', 'MEDICAL AND HEALTH SCIENCES', 'NEUROSCIENCES', 'G protein-coupled receptors', 'striatum', 'signal transduction', 'schizophrenia and related disorders', 'cognition']",624190.2,NHMRC,2016,False
Monash University,Lipid metabolism in the hypothalamus: implications for obesity and diabetes development,Prof Matthew Watt,2015,2017.0,"['Medical Physiology not elsewhere classified', 'MEDICAL AND HEALTH SCIENCES', 'MEDICAL PHYSIOLOGY', 'metabolism', 'lipid metabolism', 'obesity', 'hypothalamus', 'insulin resistance']",592915.5,NHMRC,2015,False
Monash University,Mechanisms regulating the levels of circulating insulin in response to nutrition,,2017,2020.0,"['Developmental Genetics (incl. Sex Determination)', 'BIOLOGICAL SCIENCES', 'GENETICS', 'insulin secretion', 'cell signalling', 'Drosophila', 'nutrition', 'metabolism']",326131.75,NHMRC,2017,False
Monash University,Understanding autistic spectrum disorder traits in children with attention deficit hyperactivity disorder,Dr Beth Johnson,2016,,"['Basic Science', 'attention deficit hyperactivity disorder (adhd) | autism spectrum disorders | cognitive neuroscience | psychophysiology | oculomotor']",314644.0,NHMRC,2016,False
Monash University,The investigation of markers of relapse and potential therapeutic targets in methamphetamine dependence using novel techniques,Dr Shalini Arunogiri,2015,2017.0,"['Biological Psychology (Neuropsychology, Psychopharmacology, Physiological Psychology)', 'PSYCHOLOGY AND COGNITIVE SCIENCES', 'PSYCHOLOGY', 'addiction', 'addiction treatment', 'amphetamine', 'drug relapse', 'transcranial magnetic stimulation (TMS)']",103088.56,NHMRC,2015,False
Monash University,Eye movements and the neural representation of visual space,Dr Adam Morris,2015,2018.0,"['Sensory Systems', 'MEDICAL AND HEALTH SCIENCES', 'NEUROSCIENCES', 'vision', 'cerebral cortex', 'electrophysiology', 'eye movements', 'spatial neglect']",459061.1,NHMRC,2015,False
Monash University,Ways of Halting Antimicrobial resisTance In Fiji (WHAT-IF),,2019,,"['Clinical Medicine and Science', 'antimicrobial resistance | antimicrobial therapy | health systems | public health | epidemiology']",128225.0,NHMRC,2019,False
Monash University,The Augmented versus Routine approach to Giving Energy Trial (TARGET),Prof Marianne Chapman,2015,,"['Clinical Medicine and Science', 'intensive care | critical illness | nutritional therapy | randomised controlled trial (rct) | feeding and nutrition']",3534236.0,NHMRC,2015,False
Monash University,Reappraisal of the mechanisms underlying implantation success or failure,Prof Lois Salamonsen,2018,2020.0,"['Reproduction', 'MEDICAL AND HEALTH SCIENCES', 'PAEDIATRICS AND REPRODUCTIVE MEDICINE', 'embryo implantation', 'embryo development', 'fertility', 'endometrium', 'biochemistry']",761265.4,NHMRC,2018,False
Monash University,Reappraisal of the mechanisms underlying implantation success or failure,Prof Lois Salamonsen,2018,,"['Basic Science', 'embryo implantation | embryo development | fertility | endometrium | biochemistry']",750755.0,NHMRC,2018,False
Monash University,Anti-Malarial Agents Targeting Apical Membrane Antigen 1,Prof Raymond Norton,2016,2018.0,"['Biochemistry and Cell Biology not elsewhere classified', 'BIOLOGICAL SCIENCES', 'BIOCHEMISTRY AND CELL BIOLOGY', 'malaria therapy', 'drug design', 'medicinal chemistry', 'structure-activity relationships', 'merozoite']",680632.5,NHMRC,2016,False
Monash University,Clinical utility and cost-effectiveness of genome sequencing for refractory epilepsy in children and adults: a multicentre randomised controlled trial,Prof Patrick Kwan,2018,,"['Health Services Research', 'epilepsy | genomics | drug resistance | sequencing | health economics']",720609.0,NHMRC,2018,False
Monash University,Integration of basic and translational genitourinary cancer research into academic clinical practice,Prof Ian Davis,2016,,"['Clinical Medicine and Science', 'prostate cancer | clinical research | translational research | cancer biology | clinical trial']",467961.0,NHMRC,2016,False
Monash University,Spatial and temporal dimensions of mu-opioid receptor signalling: implications for the development of tolerance,Dr Meritxell Canals,2017,,"['Basic Science', 'opioid receptors | receptor signalling | g protein-coupled receptors | receptor trafficking | protein complexes']",799316.0,NHMRC,2017,False
