institutions,title,principalInvestigator,startDate,endDate,subjects,fundingAmount,funder,startDate_clean,surrounded_by_square_brackets
Monash University,Understanding stroke care health service utilisation beyond the acute hospital setting,Dr Nadine Andrew,2014,2017.0,"['Public Health and Health Services not elsewhere classified', 'MEDICAL AND HEALTH SCIENCES', 'PUBLIC HEALTH AND HEALTH SERVICES', 'stroke', 'stroke outcome', 'public health policy', 'health service utilisation', 'health service accessibility', 'health services research']",316449.66,NHMRC,2014,False
Monash University,A dimensional approach to mapping the risk mechanisms of mental illness,Prof Alexander Fornito,2018,,"['Basic Science', 'magnetic resonance imaging (mri) | schizophrenia and related disorders | attention deficit hyperactivity disorder (adhd) | depression | connectivity']",1654808.0,NHMRC,2018,False
Monash University,Human amnion epithelial cell therapy for bronchopulmonary dyspliasa,A/Pr Timothy Moss,2015,,"['Basic Science', 'bronchopulmonary dysplasia | cell therapy | premature infant | lung development | respiratory distress syndrome (rds)']",1008691.0,NHMRC,2015,False
Monash University,Epigenetic regulation of telomere chromatin and genome stability,A/Pr Lee Wong,2017,,"['Basic Science', 'chromatin | chromatin structure | telomeres | chromosomes | epigenetics']",633447.0,NHMRC,2017,False
Monash University,Integrated system wide characterization of microbiota and host factors influencing intestinal colonization resistance to the healthcare pathogen Clostridium difficile,Dr Samuel Forster,2015,,"['Basic Science', 'systems biology | innate immunity | microbiology | molecular biology | bioinformatics']",346020.0,NHMRC,2015,False
Monash University,Improving Prevention of Stroke and Other Arterial Disease Complications by Closing Evidence-Practice Gaps,,2019,,"['Clinical Medicine and Science', 'carotid artery disease | stroke prevention | vascular disease | cardiovascular disease prevention | guidelines']",181066.0,NHMRC,2019,False
Monash University,Investigating the genetic contribution to the focal epilepsies,Dr Piero Perucca,2019,,"['Clinical Medicine and Science', 'epilepsy | focal epilepsy | genetic disorders | diagnosis | neurogenetics']",232315.0,NHMRC,2019,False
Monash University,T cell-mediated responses to influenza and Human Immunodeficiency virus (HIV) infection,A/Pr Stephanie Gras,2019,,"['Basic Science', 'structural immunology | influenza | human immunodeficiency virus (hiv) | t cell immunity | viral infection']",649175.0,NHMRC,2019,False
Monash University,2016 Equipment Grant,Dr Tsharni Zazryn,2016,2017.0,['NULL'],640045.0,NHMRC,2016,False
Monash University,Identifying Mechanisms Underlying Ethnic Inequalities in Birth Outcomes,Dr Miranda Davies-Tuck,2014,,"['Public Health', 'obstetrics | maternal health | perinatal | ethnicity | epidemiology']",304596.0,NHMRC,2014,False
Monash University,Finding the missing katanin required for male fertility,Prof Moira O'Bryan,2018,,"['Basic Science', 'meiosis | microtubules | microtubule associated protein (map) | fertility | meiosis']",417214.0,NHMRC,2018,False
Monash University,Understanding antibody responses,Prof David Tarlinton,2014,,"['Basic Science', 'adaptive immunity | differentiation | apoptosis | myeloma | germinal centre']",727610.0,NHMRC,2014,False
Monash University,Increasing precision in epidemiological exposure assessment by integrating genetic and epigenetic data,,2019,,"['Public Health', 'lifestyle factors | cancer epidemiology | genetic epidemiology | dna methylation | genetic influences']",191418.0,NHMRC,2019,False
Monash University,The ASPREE-fracture sub-study: Does daily low-dose aspirin reduce fracture risk in healthy older adults?,A/Pr Anna Barker,2014,2018.0,"['Aged Health Care', 'MEDICAL AND HEALTH SCIENCES', 'PUBLIC HEALTH AND HEALTH SERVICES', 'fracture risk', 'injury prevention', 'falls prevention', 'dementia', 'aspirin']",1351150.1,NHMRC,2014,False
Monash University,Phosphoinositide 4-phosphatases in health and disease,Prof James Whisstock,2014,2016.0,"['Structural Biology (incl. Macromolecular Modelling)', 'BIOLOGICAL SCIENCES', 'BIOCHEMISTRY AND CELL BIOLOGY', 'phosphatase', 'crystallography', 'inositol phosphates', 'shigella', 'cancer', 'second messengers']",678560.94,NHMRC,2014,False
Monash University,Facilitating endometrial receptivity to improve pregnancy outcomes,Prof Evdokia Dimitriadis,2017,2020.0,"['Reproduction', 'MEDICAL AND HEALTH SCIENCES', 'PAEDIATRICS AND REPRODUCTIVE MEDICINE', 'endometrium', 'female reproduction', 'uterus', 'reproductive biology', 'reproductive health']",752314.0,NHMRC,2017,False
Monash University,DNase I as Treatment for MPO-ANCA Vasculitis,Prof Stephen Holdsworth,2018,,"['Clinical Medicine and Science', 'kidney disease | glomerulonephritis | therapeutics | dna targeted drugs | inflammation']",868340.0,NHMRC,2018,False
Monash University,Molecular Genetics of Human Sexual Differentiation,Prof Vincent Harley,2019,,"['Basic Science', 'sex determination | sox genes | animal model | signalling pathways | parkinson disease']",792275.0,NHMRC,2019,False
Monash University,Conventional and unconventional T cells in interstitial kidney disease,Prof Michael Hickey,2018,2020.0,"['Immunology not elsewhere classified', 'MEDICAL AND HEALTH SCIENCES', 'IMMUNOLOGY', 'kidney disease', 'inflammation', 'leukocyte trafficking', 'imaging', 'microvascular']",487258.44,NHMRC,2018,False
Monash University,Activin Control of the Male Germline for Reproductive Health,Prof Katherine Loveland,2015,,"['Basic Science', 'activin | testis development | gene expression | cancer biology | epigenetics']",879516.0,NHMRC,2015,False
Monash University,Regulation of receptors that control platelet function under shear stress,A/Pr Robert Andrews,2017,,"['Clinical Medicine and Science', 'platelets | receptors | platelet function | platelet adhesion | platelet aggregation']",507273.0,NHMRC,2017,False
Monash University,A novel role for proteolysis in promoting inner ear cell injury and hearing loss,Prof Phillip Bird,2017,2020.0,"['Cell Development, Proliferation and Death', 'BIOLOGICAL SCIENCES', 'BIOCHEMISTRY AND CELL BIOLOGY', 'protease', 'serpin', 'mouse models', 'stress response', 'cochlea']",996033.1,NHMRC,2017,False
Monash University,A new signaling interface shapes cystic kidney disease,A/Pr Ian Smyth,2015,2018.0,"['Cell Development, Proliferation and Death', 'BIOLOGICAL SCIENCES', 'BIOCHEMISTRY AND CELL BIOLOGY', 'kidney disease', 'renal cystic disease', 'cell biology', 'phosphoinositides', 'signalling pathways']",586846.94,NHMRC,2015,False
Monash University,Molecular & Translational Characterisation of IMiD-Mediated BET-Protein Degradation in Multiple Myeloma,A/Pr Jake Shortt,2017,,"['Clinical Medicine and Science', 'myeloma | cancer biology | immunomodulation | therapeutics | epigenetics']",497857.0,NHMRC,2017,False
Monash University,Identification of interleukin-6 trans-signalling as a novel target for therapeutic approaches to lung cancer,Prof Brendan Jenkins,2014,2016.0,"['Molecular Targets', 'MEDICAL AND HEALTH SCIENCES', 'ONCOLOGY AND CARCINOGENESIS', 'cytokine signalling', 'lung cancer', 'lung inflammation', 'interleukin-6 (IL-6)', 'mouse models', 'therapeutic agents']",627089.25,NHMRC,2014,False
Monash University,"Dissecting TAF5L and TAF6L functions in embryonic stem cells, reprogramming and neurodevelopment",,2019,,"['Basic Science', 'epigenetics | embryonic stem cells | genomics | gene regulation | molecular biology']",691653.0,NHMRC,2019,False
Monash University,TGF-beta/Smad signalling in macrophage-mediated renal fibrosis.,A/Pr David Nikolic-Paterson,2017,2019.0,"['Medical and Health Sciences not elsewhere classified', 'MEDICAL AND HEALTH SCIENCES', 'OTHER MEDICAL AND HEALTH SCIENCES', 'kidney disease', 'glomerulosclerosis', 'renal interstitial fibrosis', 'macrophages', 'signalling pathways']",699711.25,NHMRC,2017,False
Monash University,Reduction of oxygen after cardiac arrest: The EXACT trial,Prof Stephen Bernard,2016,2020.0,"['Emergency Medicine', 'MEDICAL AND HEALTH SCIENCES', 'CLINICAL SCIENCES', 'resuscitation', 'oxygen therapy', 'cardiac arrest', 'emergency medical service', 'emergency medicine']",1954560.4,NHMRC,2016,False
Monash University,Investigating role of insulin resistance and sympathetic nervous system in metabolic features of PCOS,,2014,2018.0,"['Endocrinology', 'MEDICAL AND HEALTH SCIENCES', 'CLINICAL SCIENCES', 'polycystic ovarian syndrome (PCOS)', 'sympathetic nervous system', 'insulin resistance', 'metabolic syndrome', ""women's health"", 'reproductive health']",150468.06,NHMRC,2014,False
Monash University,Drug targeting to sites of lymph-adipose interaction to transform the treatment of disease,Dr Natalie Trevaskis,2016,2018.0,"['Pharmaceutical Sciences', 'MEDICAL AND HEALTH SCIENCES', 'PHARMACOLOGY AND PHARMACEUTICAL SCIENCES', 'drug delivery', 'pharmaceutics', 'lymphatic absorption', 'insulin resistance', 'metabolic disease']",529827.06,NHMRC,2016,False
Monash University,Early Menopause: Implementation Research using the Experiences and Perspectives of Women and Health Professionals to Translate Evidence into Practice,Prof Helena Teede,2016,,"['Health Services Research', 'menopause | cancer care | education | internet | health services research']",390074.0,NHMRC,2016,False
Monash University,The regulation of B cell differentiation and survival in response to antigen challenge,Prof David Tarlinton,2014,2018.0,"['Humoural Immunology and Immunochemistry', 'MEDICAL AND HEALTH SCIENCES', 'IMMUNOLOGY', 'adaptive immunity', 'differentiation', 'apoptosis', 'myeloma', 'germinal centre']",763409.06,NHMRC,2014,False
Monash University,Intraductal carcinoma of the prostate: indicator of aggressive disease.,Prof Gail Risbridger,2015,,"['Clinical Medicine and Science', 'prostate cancer | pathology | xenografts | human | brca1']",851915.0,NHMRC,2015,False
Monash University,A study of Statins for reducing events in the elderly,Prof Sophia Zoungas,2014,2018.0,"['Clinical Sciences not elsewhere classified', 'MEDICAL AND HEALTH SCIENCES', 'CLINICAL SCIENCES', 'clinical trial', 'prevention', 'mortality', 'elderly', 'residential care', 'statins', 'cardiovascular health']",5372965.0,NHMRC,2014,False
Monash University,Defining molecular pathways for COX2 maturation in mitochondrial Complex IV,,2019,,"['Basic Science', 'mitochondria | respiratory chain | mitochondrial disease | structural biology | protein complexes']",595788.0,NHMRC,2019,False
Monash University,Proteolytic systems in Health and Disease,Prof James Whisstock,2014,2018.0,"['Structural Biology (incl. Macromolecular Modelling)', 'BIOLOGICAL SCIENCES', 'BIOCHEMISTRY AND CELL BIOLOGY', 'protease', 'perforin', 'serpin', 'plasminogen', 'immunity', 'fibrinolysis', 'complement activation']",863413.6,NHMRC,2014,False
Monash University,Translational Research Program to Advance Clinical Outcomes in Acute Myeloid Leukaemia,A/Pr Andrew Wei,2018,2022.0,"['Haematological Tumours', 'MEDICAL AND HEALTH SCIENCES', 'ONCOLOGY AND CARCINOGENESIS', 'acute myeloid leukaemia (AML)', 'acute leukaemia', 'leukaemia', 'apoptosis', 'Bcl-2']",418192.84,NHMRC,2018,False
Monash University,A randomised trial of allowing men who have sex with men to have HIV and syphilis tests between clinic consultations.,Dr Tim Read,2015,,"['Public Health', 'syphilis | human immunodeficiency virus (hiv) | prevention | access to health care | randomised controlled trial (rct)']",369436.0,NHMRC,2015,False
Monash University,Addressing an unrecognised public health problem in Vietnam: a clustered randomised controlled trial of the culturally adapted Resourceful Adolescent Program (RAP-V) to improve adolescent mental health,,2019,,"['Public Health', 'mental health promotion | adolescent | clinical trial | developing countries | adolescent health']",498545.0,NHMRC,2019,False
Monash University,New Treatments for Acute Kidney Injury-Targeting the IL-17A pathway,Dr Shaun Summers,2014,2016.0,"['Medical and Health Sciences not elsewhere classified', 'MEDICAL AND HEALTH SCIENCES', 'OTHER MEDICAL AND HEALTH SCIENCES', 'acute renal failure', 'kidney disease', 'acute tubular necrosis', 'kidney failure', 'interleukins (IL)', 'Toll-like receptors']",507200.6,NHMRC,2014,False
Monash University,Discovery and Characterisation of Novel Tick Evasins as Inhibitors of Chemokine-mediated Inflammation,A/Pr Martin Stone,2018,2020.0,"['Biochemistry and Cell Biology not elsewhere classified', 'BIOLOGICAL SCIENCES', 'BIOCHEMISTRY AND CELL BIOLOGY', 'protein binding', 'chemokines', 'inhibition', 'inflammatory mediators', 'structure-function']",664014.9,NHMRC,2018,False
Monash University,A zebrafish model of facioscapulohumeral dystrophy for therapy development and functional studies,,2015,2020.0,"['Neurogenetics', 'BIOLOGICAL SCIENCES', 'GENETICS', 'muscle disease', 'zebrafish', 'drug screening', 'expression profiling', 'genetics']",390601.1,NHMRC,2015,False
Monash University,The impact of a public awareness campaign on cardiac arrest prevention,,2018,2021.0,"['Public Health and Health Services not elsewhere classified', 'MEDICAL AND HEALTH SCIENCES', 'PUBLIC HEALTH AND HEALTH SERVICES', 'cardiac arrest', 'acute myocardial infarction (AMI)', 'emergency medical service', 'prevention', 'mass media']",163596.69,NHMRC,2018,False
Monash University,Investigation into the intervention of arterial thrombosis and atherosclerosis using shear sensitive nanoparticle drug delivery,Dr Erik Westein,2015,2018.0,"['Cardiology (incl. Cardiovascular Diseases)', 'MEDICAL AND HEALTH SCIENCES', 'CARDIORESPIRATORY MEDICINE AND HAEMATOLOGY', 'atherosclerosis', 'nanotechnology', 'thrombosis', 'platelet aggregation', 'shear stress']",462601.4,NHMRC,2015,False
Monash University,Targeted therapies for chemo-resistant leukaemia cells,,2019,,"['Clinical Medicine and Science', 'leukaemia | stem cell biology | chemotherapy | transgenic model | clonal diversity']",727087.0,NHMRC,2019,False
Monash University,Long-term outcomes after paediatric traumatic brain injury,Dr Bridgette Semple,2018,,"['Basic Science', 'traumatic brain injury (tbi) | social and behavioural research | mouse models | inflammation | epilepsy']",431000.0,NHMRC,2018,False
Monash University,"Peptide Therapeutics for the Treatment of Autoimmune Diseases: Stability, Delivery and Disposition",Prof Raymond Norton,2015,2017.0,"['Pharmaceutical Sciences', 'MEDICAL AND HEALTH SCIENCES', 'PHARMACOLOGY AND PHARMACEUTICAL SCIENCES', 'peptides', 'autoimmune disease', 'stability', 'pharmaceutical', 'pharmacokinetics']",368467.2,NHMRC,2015,False
Monash University,Does mitochondrial metabolism in neurons act to link peripheral metabolic state to motivated food-seeking behaviour?,Dr Sarah Lockie,2014,2019.0,"['Medical Physiology not elsewhere classified', 'MEDICAL AND HEALTH SCIENCES', 'MEDICAL PHYSIOLOGY', 'hypothalamus', 'energy metabolism', 'obesity', 'behaviour', 'glucose homeostasis']",335697.22,NHMRC,2014,False
Monash University,Better targets and drugs for improving stroke outcome?,Dr Connie Wong,2016,,"['Basic Science', 'targeted therapy | stroke outcome | host/pathogen interaction | bacterial infection | sympathetic nervous system']",1085972.0,NHMRC,2016,False
Monash University,"Clonal haematopoiesis of indeterminate potential (CHIP) and its consequences for blood cancers, cardiovascular disease and stroke – the ASPREE-CHIP sub-study",,2019,,"['Clinical Medicine and Science', 'haematopoiesis | ageing | cardiovascular disease | haematological malignancy | aspirin']",1416603.0,NHMRC,2019,False
Monash University,Neurophysiology of attention deficits after right hemisphere stroke,Prof Mark Bellgrove,2018,2020.0,"['Biological Psychology (Neuropsychology, Psychopharmacology, Physiological Psychology)', 'PSYCHOLOGY AND COGNITIVE SCIENCES', 'PSYCHOLOGY', 'attention', 'stroke', 'electroencephalogram (EEG)', 'spatial neglect', 'cognitive neuroscience']",620306.4,NHMRC,2018,False
Monash University,Cardiovascular effects of enhanced leptin signalling,Prof Michael Cowley,2016,,"['Basic Science', 'leptin | hypertension | phosphatase | hypothalamus | signal transduction']",1200972.0,NHMRC,2016,False
Monash University,Improving the assessment of environmental health risks with new technology and novel approaches,A/Pr Yuming Guo,2019,,"['Public Health', 'environmental health | environmental epidemiology | environmental risk factors | epidemiology | environmental pollutants']",483404.0,NHMRC,2019,False
Monash University,The opposing genetic networks underlying plasticity of humoral responses,Dr Kim Jacobson,2014,2018.0,"['Humoural Immunology and Immunochemistry', 'MEDICAL AND HEALTH SCIENCES', 'IMMUNOLOGY', 'humoral immunity', 'chemokine receptor', 'antibody', 'B cells', 'immunoglobulin (Ig)', 'lymphocyte differentiation', 'immunologic memory', 'transcription factor', 'lymphocyte migration', 'molecular immunology']",667783.8,NHMRC,2014,False
Monash University,"NLRC5, a new regulator of Helicobacter-induced inflammation",Prof Richard Ferrero,2016,,"['Basic Science', 'helicobacter pylori | pathogenesis | host/pathogen interaction | chronic infection | pathogenic mechanisms']",640136.0,NHMRC,2016,False
Monash University,Towards Prevention of Acute Kidney Injury after Cardiac Surgery,Prof Roger Evans,2017,2019.0,"['Systems Physiology', 'MEDICAL AND HEALTH SCIENCES', 'MEDICAL PHYSIOLOGY', 'renal medulla', 'renal failure', 'cardiopulmonary bypass', 'renal physiology', 'mathematical modelling']",789121.9,NHMRC,2017,False
Monash University,Integrated approaches to targeting G protein-coupled receptors: Translational studies of novel drug-receptor paradigms,Prof Arthur Christopoulos,2016,,"['Basic Science', 'drug discovery | g protein-coupled receptors | pharmacology | structural biology | neuropharmacology']",851980.0,NHMRC,2016,False
Monash University,Extending life after lung transplantation – Defining the structural and immunological drivers of chronic lung allograft dysfunction,A/Pr Glen Westall,2018,,"['Clinical Medicine and Science', 'lung transplantation | humoral immunology | microarray analysis | b cells | natural killer cells']",739190.0,NHMRC,2018,False
Monash University,"Optimising inhaled polymyxins as a vital therapy for pulmonary infections: A novel biochemical, molecular imaging and systems pharmacology approach",Prof Jian Li,2016,,"['Basic Science', 'antibiotic therapy | antibiotic resistance | transporters | molecular imaging | pharmacokinetics']",728044.0,NHMRC,2016,False
Monash University,Improving pregnancy care for populations at risk in Australia,Dr Melanie Gibson-Helm,2016,,"['Public Health', 'pregnancy | maternal health | aboriginal health | polycystic ovarian syndrome (pcos) | refugee health']",314644.0,NHMRC,2016,False
Monash University,Failure-to-progress in human labour results from a profound electrical negativity of the uterine cells: Targeting the ion channels involved,Prof Helena Parkington,2017,,"['Basic Science', 'smooth muscle | potassium channels | electrophysiology | uterus | dysfunctional labour']",564541.0,NHMRC,2017,False
Monash University,A new signaling interface shapes cystic kidney disease,Prof Ian Smyth,2015,,"['Basic Science', 'kidney disease | renal cystic disease | cell biology | phosphoinositides | signalling pathways']",568475.0,NHMRC,2015,False
Monash University,Targeting epigenetic pathways that lead to diabetic complications,Prof Mark Cooper,2018,2021.0,"['Medical and Health Sciences not elsewhere classified', 'MEDICAL AND HEALTH SCIENCES', 'OTHER MEDICAL AND HEALTH SCIENCES', 'diabetic complications', 'nephropathy', 'atherosclerosis', 'diabetic nephropathy', 'diabetes']",1003807.25,NHMRC,2018,False
Monash University,Systems Neuroscience of Attention Deficit Hyperactivity Disorder (ADHD),Prof Mark Bellgrove,2019,,"['Basic Science', 'attention deficit hyperactivity disorder (adhd) | attention | cognition | molecular genetics | brain imaging']",717275.0,NHMRC,2019,False
Monash University,"Aboriginal and Torres Strait Islander stroke incidence, mortality and disability study.",,2019,,"['Public Health', 'aboriginal | stroke | cerebrovascular disease | epidemiology | indigenous health']",92746.0,NHMRC,2019,False
Monash University,Novel radioligands for PET imaging and phenotyping of multiple sclerosis diagnosis,Prof Jonathan Baell,2018,2020.0,"['Molecular Medicine', 'CHEMICAL SCIENCES', 'MEDICINAL AND BIOMOLECULAR CHEMISTRY', 'multiple sclerosis (MS)', 'diagnostic imaging', 'medicinal chemistry', 'positron emission tomography (PET)', 'kinases']",829277.6,NHMRC,2018,False
Monash University,"How should we analyse, synthesize, and interpret evidence from interrupted time series studies? Making the best use of available evidence",Dr Joanne McKenzie,2018,,"['Public Health', 'biostatistics | intervention study | meta-analysis | evidence-based health care | population health']",445144.0,NHMRC,2018,False
Monash University,Molecular basis for conjugative transfer of antibiotic resistance genes in Gram positive pathogens,Prof Julian Rood,2016,,"['Basic Science', 'antibiotic resistance | plasmids | bacterial genetics | gene transfer | structural biology']",872660.0,NHMRC,2016,False
Monash University,Pathophysiology and treatment of nonalcoholic fatty liver disease: Effects of bariatric surgery,,2016,2018.0,"['Surgery', 'MEDICAL AND HEALTH SCIENCES', 'CLINICAL SCIENCES', 'obesity', 'fatty liver disease', 'surgery', 'weight loss', 'fibrosis']",90967.63,NHMRC,2016,False
Monash University,Mapping the molecular blueprint for immune cell differentitation,Prof Stephen Turner,2016,,"['Basic Science', 't cell immunity | memory t-cells | epigenetics | chromatin structure | viral immunity']",753300.0,NHMRC,2016,False
Monash University,Defining the role of glycosylation in basement membrane failure during muscular dystrophy,Prof Peter Currie,2017,,"['Basic Science', 'muscular dystrophy | muscle degeneration | zebrafish | glycobiology | cell adhesion']",824664.0,NHMRC,2017,False
Monash University,Novel Anti-Infective Agents that Act by Enhancing the Host Innate Response,Prof Raymond Norton,2016,,"['Basic Science', 'inducible nitric oxide synthase (inos) | suppressor of cytokine signalling (socs) | peptide inhibitors | drug conjugation | macrophages']",655482.0,NHMRC,2016,False
Monash University,"Anaemia in the elderly: epidemiology, causes, consequences and optimal transfusion strategies",,2018,2021.0,"['Public Health and Health Services not elsewhere classified', 'MEDICAL AND HEALTH SCIENCES', 'PUBLIC HEALTH AND HEALTH SERVICES', 'anaemia', 'blood transfusion', 'elderly', 'health outcomes', 'myelodysplasia']",128224.82,NHMRC,2018,False
Monash University,A structural understanding of class B G protein-coupled receptor function,Prof Patrick Sexton,2017,,"['Basic Science', 'g protein-coupled receptors | structure-function | signal transduction | electron microscopy | molecular pharmacology']",1289570.0,NHMRC,2017,False
Monash University,The role of membrane phospholipids in regenerative axonal fusion,Dr Brent Neumann,2016,,"['Basic Science', 'molecular neuroscience | axon regeneration | cell biology | cell membrane | axonal injury']",571950.0,NHMRC,2016,False
Monash University,New strategies to target multiple drug resistance in clinically relevant fungal infections.,,2015,2020.0,"['Structural Biology (incl. Macromolecular Modelling)', 'BIOLOGICAL SCIENCES', 'BIOCHEMISTRY AND CELL BIOLOGY', 'drug development', 'infectious diseases', 'resistance spread', 'structural biology', 'protein characterisation']",378925.7,NHMRC,2015,False
Monash University,Sleep and motherhood: towards a sustainable cognitive behavioural program for better sleep and wellbeing during pregnancy and postpartum periods.,Dr Bei Bei,2018,,"['Clinical Medicine and Science', 'sleep | pregnancy | cognitive behaviour therapy | mental health | perinatal']",286891.0,NHMRC,2018,False
Monash University,A biomimetic prodrug platform to enable oral bioavailability and target lymphatic disease,Dr Sifei Han,2017,,"['Basic Science', 'drug delivery | lymphatic absorption | drug metabolism | drug absorption | lipid metabolism']",408768.0,NHMRC,2017,False
Monash University,Integrated system wide characterization of microbiota and host factors influencing intestinal colonization resistance to the healthcare pathogen Clostridium difficile,,2015,2019.0,"['Innate Immunity', 'MEDICAL AND HEALTH SCIENCES', 'IMMUNOLOGY', 'systems biology', 'innate immunity', 'microbiology', 'molecular biology', 'bioinformatics']",359999.7,NHMRC,2015,False
Monash University,Structural and functional investigation of Killer-Cell Immunoglobulin-like receptors,Dr Julian Vivian,2016,,"['Basic Science', 'immunology | natural killer cells | innate immunity | structural immunology | receptor binding']",546966.0,NHMRC,2016,False
Monash University,Overcoming the differentiation block in acute myeloid leukaemia,A/Pr Ross Dickins,2017,,"['Basic Science', 'leukaemia | acute leukaemia | differentiation | therapy | transcriptional regulation']",811669.0,NHMRC,2017,False
Monash University,Exploring the innate immune system of bone marrow,A/Pr Meredith O'Keeffe,2015,,"['Basic Science', 'bone marrow | dendritic cell | immune function | interferon (ifn) | memory t-cells']",611645.0,NHMRC,2015,False
Monash University,Targeting the Achilles' heel of polymyxins: eliminating the nephrotoxicity,Prof Jian Li,2015,2017.0,"['Pharmacology and Pharmaceutical Sciences not elsewhere classified', 'MEDICAL AND HEALTH SCIENCES', 'PHARMACOLOGY AND PHARMACEUTICAL SCIENCES', 'antibiotic resistance', 'antibiotic therapy', 'drug discovery', 'nephrotoxicity', 'pharmacodynamics']",673420.44,NHMRC,2015,False
