institutions,title,principalInvestigator,startDate,endDate,subjects,fundingAmount,funder,startDate_clean,surrounded_by_square_brackets
Monash University,Australian and New Zealand Children's Haematology/Oncology Group,Not applicable,2018-09-25 00:00:00,2024-09-28 00:00:00,Not available,3010000.0,MRFF,2018,False
Monash University,Using Polygenic Risk Scores to Target Statin Therapy in Primary Prevention,Professor Stephen Nicholls,2020-06-01 00:00:00,2024-11-30 00:00:00,Cardiology (Incl. Cardiovascular Diseases),1416095.0,MRFF,2020,False
Monash University,Statins and Progression of Coronary Atherosclerosis in Melanoma Patients Treated with Immune Checkpoint Inhibitors,Professor Stephen Nicholls,2021-06-01 00:00:00,2025-05-31 00:00:00,Cardiology (Incl. Cardiovascular Diseases),1669300.28,MRFF,2021,False
Monash University,ECMO-Rehab: A Randomised Controlled Trial of Early Cardiac Rehabilitation to Improve Survival and Recovery in Critically-ill Patients on ECMO,Professor Carol Hodgson,2021-06-01 00:00:00,2024-05-31 00:00:00,Intensive Care,662648.57,MRFF,2021,False
Monash University,New models of rehabilitation to improve work and health outcomes after stroke,Professor Natasha Lannin,2021-06-01 00:00:00,2023-12-31 00:00:00,Rehabilitation And Therapy (Excl. Physiotherapy),999056.2,MRFF,2021,False
Monash University,"Atheroma Progression in Clonal Haematopoiesis Investigation with Imaging, Biomarkers and Genomic Sequencing (ARCHIMEDES)",Professor Stephen Nicholls,2022-06-01 00:00:00,2025-05-31 00:00:00,"Cardiorespiratory Medicine And Haematology, Cardiovascular Medicine And Haematology Not Elsewhere Classified",996384.68,MRFF,2022,False
Monash University,Addressing the poor medication adherence in prevention of cardiovascular mortality and morbidity in Australia: development of a clinical decision support tool,Doctor Stella Talic,2022-06-01 00:00:00,2026-05-31 00:00:00,"Public Health And Health Services, Primary Health Care",706241.6,MRFF,2022,False
Monash University,Love Your Brain: A stroke prevention digital platform,Associate Professor Monique Kilkenny,2022-06-01 00:00:00,2025-12-31 00:00:00,"Public Health And Health Services, Health Promotion",944787.9,MRFF,2022,False
Monash University,Combining Novel Imaging Biomarkers with AI-Accelerated Diagnosis for Equitable Patient Selection To Proactive Treatment With Middle Meningeal Artery Embolisation To Improve Outcomes in cSDH,Professor Roland Bammer,2022-06-01 00:00:00,2025-12-31 00:00:00,"Clinical Sciences, Radiology And Organ Imaging",999865.7,MRFF,2022,False
Monash University,PRecision Ecmo in CardIogenic Shock Evaluation: PRECISE Study,Doctor Aidan Burrell,2022-06-01 00:00:00,2025-05-31 00:00:00,"Cardiorespiratory Medicine And Haematology, Cardiology (Incl. Cardiovascular Diseases)",999779.4,MRFF,2022,False
Monash University,Using co-design to improve accessibility and acceptability of cardiac services for vulnerable populations: The Equal Hearts Study,Doctor Alison Beauchamp,2022-06-01 00:00:00,2025-10-01 00:00:00,"Public Health And Health Services, Public Health And Health Services Not Elsewhere Classified",597104.3,MRFF,2022,False
Monash University,Improving short- and long-term outcomes in cardiac bypass surgery by preventing acute kidney injury,Professor David Nikolic-Paterson,2022-06-01 00:00:00,2024-05-31 00:00:00,"Clinical Sciences, Nephrology And Urology",511208.0,MRFF,2022,False
Monash University,Discovery of new molecular targets for stroke-Associated pneumonia to improve recovery,Associate Professor Connie Wong,2022-06-01 00:00:00,2024-12-31 00:00:00,"Cardiorespiratory Medicine And Haematology, Cardiology (Incl. Cardiovascular Diseases), Medical Biochemistry And Metabolomics, Medical Biochemistry And Metabolomics Not Elsewhere Classified, Immunology, Cellular Immunology",663217.6,MRFF,2022,False
Monash University,Advancing preclinical development of novel GPCR-targeted therapeutics for heart failure,Professor Rebecca Ritchie ,2023-02-01 00:00:00,2026-01-31 00:00:00,"Biomedical And Clinical Sciences, Cardiovascular Medicine And Haematology, Cardiology (Incl. Cardiovascular Diseases)",1496862.61,MRFF,2023,False
Monash University,"A collaborative study of the Interfant network (Australian sites): the feasibility, safety and efficacy of the addition of Blinatumomab to the Interfant-06 backbone in infants with MLL-rearranged Acute Lymphoblastic Leukaemia (The Blin-fant Study)",Doctor Rishi Kotecha,2018-06-13 00:00:00,2023-12-31 00:00:00,Cancer Therapy (Excl. Chemotherapy And Radiation Therapy),314771.57,MRFF,2018,False
Monash University,A registry-linked national platform trial to improve precision-based outcomes using novel therapies in acute myeloid leukaemia (AML),Associate Professor Andrew Wei,2018-06-18 00:00:00,2023-12-31 00:00:00,Clinical Sciences Not Elsewhere Classified,1507785.35,MRFF,2018,False
Monash University,CAST – A Randomised Phase 3 Trial of Cyclophosphamide after Sibling Allogeneic Haematopoietic Stem Cell Transplant,Associate Professor David Curtis,2018-06-13 00:00:00,2024-02-15 00:00:00,Haematology,1570198.12,MRFF,2018,False
Monash University,The BLENDER Trial – Blend to Limit Oxygen in ECMO: A randomised Controlled Registry Trial,Professor David Pilcher,2018-06-13 00:00:00,2024-06-30 00:00:00,Intensive Care,753355.46,MRFF,2018,False
Monash University,"The DIAAMOND study: Diagnosis of aplastic anaemia, management, and outcomes utilising a national dataset",Associate Professor Erica Wood,2018-06-13 00:00:00,2024-02-15 00:00:00,Haematology,1750726.49,MRFF,2018,False
Monash University,COZMOS: Phase I/Ib trial of COmbined 5'-aZacitidine and carboplatin for recurrent/refractory paediatric brain and solid tuMOurs,Doctor Jordan Hansford,2019-04-01 00:00:00,2024-03-31 00:00:00,Chemotherapy,125354.5,MRFF,2019,False
Monash University,"ErythroPOietin alfa to prevent mortality and reduce severe disability in critically ill TRAUMA patients: a multicentre, stratified, double blind, placebo randomised controlled trial. (The EPO-TRAUMA trial)",Associate Professor Craig French,2019-04-01 00:00:00,2025-03-31 00:00:00,Intensive Care,3509303.1,MRFF,2019,False
Monash University,Evaluating the effectiveness and safety of sodium selenate as a disease modifying treatment for patients with behavioural variant Frontotemporal Dementia (bvFTD),Professor Terence O'Brien,2019-04-01 00:00:00,2024-03-31 00:00:00,Neurology And Neuromuscular Diseases,1604184.4,MRFF,2019,False
Monash University,FaR-RMS: Frontline And Relapse study in RhabdoMyoSarcoma,Doctor Martin Campbell,2019-04-01 00:00:00,2025-03-31 00:00:00,Solid Tumours,1353514.4,MRFF,2019,False
Monash University,"SJ-ELiOT: St Jude - Phase 1 Evaluation of LY2606368, Molecularly-Targeted CHK1/2i Therapy, in Combination with Cyclophosphamide or Gemcitabine for Children and Adolescents with Refractory or Recurrent Medulloblastoma Brain Tumours",Associate Professor Nicholas Gottardo,2019-04-01 00:00:00,2024-03-31 00:00:00,Chemotherapy,226283.6,MRFF,2019,False
Monash University,Brain Oxygen Neuromonitoring In Australia And New Zealand Assessment (BONANZA) Trial ,Associate Professor Andrew Udy,2019-01-03 00:00:00,2024-11-30 00:00:00,Intensive Care,1084852.43,MRFF,2019,False
Monash University,Frailty-stratified randomised controlled bayesian adaptive trial of bortezomib versus lenalidomide in transplant-ineligible myeloma - the FRAIL-M study,Professor Andrew Spencer,2019-01-03 00:00:00,2024-09-30 00:00:00,Haematological Tumours,1682835.68,MRFF,2019,False
Monash University,Improving survival in myelofibrosis,Professor Andrew Perkins,2019-01-03 00:00:00,2023-12-31 00:00:00,Haematology,1733327.17,MRFF,2019,False
Monash University,CONNECT 1903: A Pilot and Surgical Study of Larotrectinib for Disease Control in Children with Newly-Diagnosed High-Grade Glioma with NTRK Fusion,Associate Professor Nicholas Gottardo,2020-06-01 00:00:00,2025-05-31 00:00:00,Cancer Therapy (Excl. Chemotherapy And Radiation Therapy),323898.0,MRFF,2020,False
Monash University,MET-MED Trial: A phase III randomised double-blind placebo-controlled trial of metformin for cognitive recovery and white matter growth in paediatric medulloblastoma patients,Doctor Jordan Hansford,2020-06-01 00:00:00,2026-05-31 00:00:00,Oncology And Carcinogenesis Not Elsewhere Classified,879903.5,MRFF,2020,False
Monash University,The TiNT Trial: A phase II clinical trial of trametinib in paediatric patients with neurofibromatosis type 1 associated progressive optic pathway gliomas,Associate Professor Geoffrey McCowage,2020-06-01 00:00:00,2027-05-31 00:00:00,Cancer Therapy (Excl. Chemotherapy And Radiation Therapy),761210.0,MRFF,2020,False
Monash University,Sodium Selenate as a Disease Modifying Treatment for Progressive Supranuclear Palsy (Sodium Selenate for PSP),Professor Terence O'Brien,2020-06-01 00:00:00,2025-05-31 00:00:00,Central Nervous System,2639490.0,MRFF,2020,False
Monash University,Autoimmune Encephalitis - a rare and debilitating neurological illness affecting the Australian population. A study of the Australian Autoimmune Encephalitis Consortium,Doctor Mastura Monif,2020-06-01 00:00:00,2025-05-31 00:00:00,Clinical Sciences Not Elsewhere Classified,2092824.8,MRFF,2020,False
Monash University,The Long-term Outcomes of Lidocaine Infusions for persistent PostOperative Pain in patients undergoing breast surgery (LOLIPOP) Trial,Professor Tomas Corcoran,2020-06-01 00:00:00,2025-05-31 00:00:00,Sensory Systems,4334375.0,MRFF,2020,False
Monash University,Australasian Resuscitation In Sepsis Evaluation: Fluid or Vasopressors in Emergency Department Sepsis (ARISE:Fluids) Trial,Professor Sandra Peake,2020-06-01 00:00:00,2026-05-31 00:00:00,Emergency Medicine,2335540.2,MRFF,2020,False
Monash University,Bone Loss Prevention with Zoledronic Acid or Denosumab in Critically Ill Women – A Randomised Controlled Trial (Bone Zone),Associate Professor Neil Orford,2020-06-01 00:00:00,2025-05-31 00:00:00,Intensive Care,1905282.7,MRFF,2020,False
Monash University,"Preventing bones loss and restoring sexual function in women with premature ovarian insufficiency: a randomised, double-blind, placebo-controlled clinical trial",Professor Susan Davis,2021-06-01 00:00:00,2026-05-31 00:00:00,Endocrinology,912513.6599999999,MRFF,2021,False
Monash University,Third Degree Burn Wound Closure using Engineered Skin - Phase I Clinical Trial,Associate Professor Heather Cleland,2021-06-01 00:00:00,2026-05-31 00:00:00,Surgery,2363239.1500000004,MRFF,2021,False
Monash University,More efficient delivery of high-cost standard-of-care therapies in relapsed multiple myeloma using real-time feedback of patient-reported outcome measures: the MY-PROMPT-2 trial,Professor Andrew Spencer,2022-02-01 00:00:00,2027-01-31 00:00:00,Chemotherapy,1678493.0,MRFF,2022,False
Monash University,"REDEEM: A Randomised Controlled Trial of ECMO to Desedate, Extubate Early and Mobilise in severe acute respiratory infection",Doctor Aidan Burrell,2022-01-01 00:00:00,2027-01-31 00:00:00,Intensive Care,2534432.0,MRFF,2022,False
Monash University,INTER-EWING -1 - International clinical research program to improve outcomes in newly diagnosed Ewing Sarcoma patients - Trial 1.,Associate Professor Geoffrey McCowage,2022-02-01 00:00:00,2027-01-31 00:00:00,Solid Tumours,998608.8,MRFF,2022,False
Monash University,Fibrinogen Early In Severe Trauma StudY II (FEISTY II),Associate Professor Zoe McQuilten,2022-02-01 00:00:00,2027-01-31 00:00:00,Emergency Medicine,3162379.4,MRFF,2022,False
Monash University,SCANPatient: Synoptic reporting of CT scans assessing cancer of the pancreas,Associate Professor Charles Pilgrim,2022-02-01 00:00:00,2027-01-31 00:00:00,Cancer Diagnosis,2970301.1,MRFF,2022,False
Monash University,"Duration of Cardiac Antimicrobial Prophylaxis Outcomes Study (CALIPSO): multicentre, adaptive, double-blind, three-arm, placebo-controlled, non-inferiority trial examining antimicrobial prophylaxis duration in cardiac surgery",Associate Professor Trisha Peel,2022-02-01 00:00:00,2027-05-31 00:00:00,Infectious Diseases,7979999.1,MRFF,2022,False
Monash University,Adaptive platform trial for severe community acquired pneumonia: new interventions for severe CAP and influenza,Professor Steve Webb,2022-06-01 00:00:00,2026-05-31 00:00:00,"Clinical Sciences, Intensive Care",2824703.4,MRFF,2022,False
Monash University,Generating new evidence to reduce complications and improve the safety and efficacy of extracorporeal membrane oxygenation (ECMO) in patients with severe cardiac and respiratory failure: THE RECOMMEND Platform Trial,Professor Carol Hodgson,2023-02-01 00:00:00,2028-01-31 00:00:00,"Clinical Sciences, Intensive Care",2985992.73,MRFF,2023,False
Monash University,"A Phase 2, double-blind, placebo-controlled trial of sodium selenate as a disease modifying treatment for chronic drug resistant temporal lobe epilepsy (SELECT Trial)",Professor Terence O'Brien,2023-02-01 00:00:00,2028-01-31 00:00:00,"Neurosciences, Central Nervous System",2961326.74,MRFF,2023,False
Monash University,Interfant-21: A new international clinical trial for infants diagnosed with KMT2A-rearranged acute lymphoblastic leukaemia,Associate Professor Rishi Kotecha,2023-02-01 00:00:00,2028-01-31 00:00:00,"Oncology And Carcinogenesis, Cancer Therapy (Excl. Chemotherapy And Radiation Therapy)",718933.55,MRFF,2023,False
Monash University,Just Say No to the Just in Case Cannula: An Implementation Science Trial with Roadmap for National Roll Out,Professor Diana Egerton-Warburton,2023-02-01 00:00:00,2028-01-31 00:00:00,"Clinical Sciences, Emergency Medicine, Applied Economics, Health Economics, Public Health And Health Services, Public Health And Health Services Not Elsewhere Classified",2890283.87,MRFF,2023,False
Monash University,The CONSEP trial: Implementing screening for a hidden cause of hypertension,Associate Professor Jun Yang,2023-02-01 00:00:00,2027-04-30 00:00:00,"Clinical Sciences, Endocrinology, Public Health And Health Services, Primary Health Care, Cardiorespiratory Medicine And Haematology, Cardiology (Incl. Cardiovascular Diseases)",2299203.19,MRFF,2023,False
Monash University,Personalised Exercise Rehabilitation FOR people with Multimorbidity - The PERFORM trial,Professor Anne Holland,2023-06-01 00:00:00,2027-11-30 00:00:00,"Health Sciences, Allied Health And Rehabilitation Science, Rehabilitation",2999443.5,MRFF,2023,False
Monash University,A national cancer outcome strategy,Professor John Zalcberg,2019-01-01 00:00:00,2024-06-30 00:00:00,Public Health And Health Services Not Elsewhere Classified,487893.0,MRFF,2019,False
Monash University,Cognitive Phenotyping and Personalised Treatment for Methamphetamine Addiction,Associate Professor Antonio Verdejo-Garcia,2018-01-01 00:00:00,2021-12-31 00:00:00,"Biological Psychology (Neuropsychology, Psychopharmacology, Physiological Psychology)",476728.0,MRFF,2018,False
Monash University,fungalAi: Breaking the mould of the traditional antifungal stewardship paradigm,Doctor Michelle Ananda-Rajah,2019-01-01 00:00:00,2020-12-31 00:00:00,Infectious Diseases,181066.0,MRFF,2019,False
Monash University,Generating and translating evidence into practice in women’s health and beyond,Professor Helena Teede,2018-01-01 00:00:00,2022-12-31 00:00:00,Public Health And Health Services Not Elsewhere Classified,494733.0,MRFF,2018,False
Monash University,Improving outcomes for critically ill patients after traumatic brain injury and blood transfusion,Professor David Cooper,2018-01-01 00:00:00,2022-12-31 00:00:00,Intensive Care,412277.5,MRFF,2018,False
Monash University,Improving outcomes in low back pain: Targeting specific therapies to patient subgroups,Doctor Donna Urquhart,2018-01-01 00:00:00,2023-12-31 00:00:00,Clinical Sciences Not Elsewhere Classified,429055.2,MRFF,2018,False
Monash University,Next Generation Targeting of DNA-Methylation in Poor Risk Lymphoid Cancer,Associate Professor Jake Shortt,2019-01-01 00:00:00,2022-12-31 00:00:00,Haematological Tumours,218518.0,MRFF,2019,False
Monash University,Novel targeted onco-theranostic nanoparticles for personalised therapy and real-time monitoring,Doctor Karen Alt,2018-01-01 00:00:00,2021-12-31 00:00:00,Cancer Therapy (Excl. Chemotherapy And Radiation Therapy),431000.0,MRFF,2018,False
Monash University,Optimising Emergency and Trauma Systems through evidence based pathways,Professor Peter Cameron,2018-01-01 00:00:00,2022-12-31 00:00:00,Health And Community Services,412277.5,MRFF,2018,False
Monash University,Precision medicine for epilepsy and beyond: from discovery to implementation and evaluation,Professor Patrick Kwan,2018-01-01 00:00:00,2022-12-31 00:00:00,Central Nervous System,481155.5,MRFF,2018,False
Monash University,Reducing Brain Injury and Improving The Care Of High-Risk Newborn Infants,Associate Professor Flora Wong,2019-01-01 00:00:00,2022-12-31 00:00:00,Paediatrics,241702.0,MRFF,2019,False
Monash University,Optimise Primary Aldosteronism Detection For Better Health Outcomes,Doctor Jun Yang,2021-01-01 00:00:00,2025-12-31 00:00:00,Endocrinology,570205.0,MRFF,2021,False
Monash University,Blood based detection and monitoring of pre-malignant clonal haematopoiesis to predict clinical outcomes in the immunocompromised,Doctor Paul Yeh,2020-06-01 00:00:00,2025-12-31 00:00:00,Haematology,620734.77,MRFF,2020,False
Monash University,Equipping Tertiary Care for the Optimal Diagnosis of Primary Aldosteronism,Doctor Jun Yang,2022-04-14 00:00:00,2025-05-31 00:00:00,Not available,2993294.0,MRFF,2022,False
Monash University,Intensive physiotherapy to lower hospital length of stay after hip fracture,Professor Anne Holland ,2022-04-14 00:00:00,2025-06-30 00:00:00,Not available,2930647.0,MRFF,2022,False
Monash University,PROMOTE: a cluster-randomised implementation trial to promote evidence use,Professor Natasha Lannin,2022-04-14 00:00:00,2025-09-16 00:00:00,Not available,2996464.0,MRFF,2022,False
Monash University,A national platform for improving quality of nutrition care for critically ill adults and children,Doctor Emma Ridley,2023-02-01 00:00:00,2027-07-31 00:00:00,"Biomedical And Clinical Sciences, Clinical Sciences, Intensive Care ",1494950.9,MRFF,2023,False
Monash University,"Australian Autoimmune Encephalitis Consortium Study - improving diagnosis, outcomes, and quality of care for patients with this devastating neurological illness",Associate Professor Mastura Monif,2024-03-01 00:00:00,2028-02-29 00:00:00,"Biomedical And Clinical Sciences, Neurosciences, Central Nervous System",1468455.56,MRFF,2024,False
Monash University,Improving Pelvic Organ Prolapse Surgical Outcomes in Women with Nanotechnology,Professor Anna Rosamilia,2024-03-01 00:00:00,2028-02-29 00:00:00,"Biomedical And Clinical Sciences, Reproductive Medicine, Obstetrics And Gynaecology",1367696.07,MRFF,2024,False
Monash University,"A clinician-led feasibility, acceptability and pilot efficacy intervention to improve bone health and muscle strength in people with multiple sclerosis",Doctor Lisa Grech,2024-03-01 00:00:00,2028-02-29 00:00:00,"Biomedical And Clinical Sciences, Clinical Sciences, Clinical Sciences Not Elsewhere Classified, Health Sciences, Health Services And Systems, Health Management",1467407.17,MRFF,2024,False
Monash University,Optimising chest pain pathways that ensure earlier access to definitive care for patients in remote and rural communities,Professor Dion Stub ,2024-03-01 00:00:00,2028-02-29 00:00:00,"Health Sciences, Health Services And Systems, Rural And Remote Health Services",1464955.38,MRFF,2024,False
Monash University,The role of caregivers in recognition and response to serious childhood illness: a mixed-methods study,Professor Simon Craig,2024-03-01 00:00:00,2028-02-29 00:00:00,"Biomedical And Clinical Sciences, Clinical Sciences, Emergency Medicine",1468068.34,MRFF,2024,False
Monash University,COVID-19 Clinical Evidence Taskforce,Associate Professor Julian Elliott,2020-05-15 00:00:00,2021-06-30 00:00:00,Not available,1500000.0,MRFF,2020,False
Monash University,Inhaled oligonucleotides to generate a decoy receptor for the SARS Coronavirus-2,Professor Merlin Thomas,2020-06-01 00:00:00,2021-02-28 00:00:00,Biologically Active Molecules,297057.9,MRFF,2020,False
Monash University,Convalescent Plasma for COVID-19,Associate Professor Zoe McQuilten,2020-06-01 00:00:00,2021-02-28 00:00:00,Infectious Diseases,371606.0,MRFF,2020,False
Monash University,Ivermectin as an anti-viral against SARS-CoV-2,Doctor Kylie Wagstaff,2020-06-01 00:00:00,2021-02-28 00:00:00,Medical Virology,344458.7,MRFF,2020,False
Monash University,Mobilising and empowering parents in the COVID-19 mental health response: A single-arm trial of an enhanced online parenting intervention to improve parent risk and protective factors for adolescent mental health,Associate Professor Marie Yap,2020-11-01 00:00:00,2022-12-31 00:00:00,Mental Health,610922.75,MRFF,2020,False
Monash University,Effectiveness of tailored COVID-19 message for vulnerable Australians,Professor Terry Haines,2021-02-01 00:00:00,2022-09-30 00:00:00,Not available,315961.0,MRFF,2021,False
Monash University,Towards a national data management platform and Learning Health System,Professor Helena Teede,2021-02-01 00:00:00,2022-06-30 00:00:00,Not available,1922584.0,MRFF,2021,False
Monash University,Real-time modelling of Australia's COVID-19 response,Professor James Trauer,2021-02-01 00:00:00,2022-07-29 00:00:00,Not available,810300.0,MRFF,2021,False
Monash University,"A national, multi-centre study evaluating Thrombotic Thrombocytopenia Syndrome (TTS) associated with ChAdOx1 (AZD1222) and other SARS-CoV-2 vaccines (viral vector and m-RNA)",Professor Huyen Tran,2021-11-01 00:00:00,2024-10-31 00:00:00,Public Health And Health Services Not Elsewhere Classified,2917087.28,MRFF,2021,False
Monash University,Bringing Optimised COVID-19 vaccine Schedules To ImmunoCompromised populations (BOOST-IC),Associate Professor James McMahon,2022-01-01 00:00:00,2024-12-31 00:00:00,Infectious Diseases,2911774.24,MRFF,2022,False
Monash University,A coordinated multiplatform randomised trial for hospitalised patients with COVID-19,Professor Steve Webb,2022-06-01 00:00:00,2026-05-30 00:00:00,"Clinical Sciences, Intensive Care",3997914.2,MRFF,2022,False
Monash University,"Pre-clinical testing of novel inhaled RNA therapies for stability, safety and effectiveness against SARS-CoV-2 to demonstrate proof of concept",Professor Merlin Thomas,2022-06-01 00:00:00,2024-05-30 00:00:00,"Medical Biotechnology, Gene And Molecular Therapy",499697.24,MRFF,2022,False
Monash University,PROPHECY: Profiling immune RespOnse in Paediatric and High-risk populations to SARS-CoV-2,Associate Professor Menno van Zelm,2022-06-01 00:00:00,2026-05-30 00:00:00,"Immunology, Humoral Immunology And Immunochemistry, Immunology, Cellular Immunology, Clinical Sciences, Infectious Diseases",6327279.57,MRFF,2022,False
Monash University,Knowledge brokers for evidence translation to improve quality use of medicines in residential aged care,Professor Simon Bell,2021-06-01 00:00:00,2025-05-31 00:00:00,Aged Health Care,1952566.0,MRFF,2021,False
Monash University,"Better Environment, Healthier Ageing",Professor Yuming Guo,2022-06-01 00:00:00,2027-05-31 00:00:00,"Public Health And Health Services, Epidemiology, Public Health And Health Services, Environmental And Occupational Health And Safety, Public Health And Health Services, Preventive Medicine",200000.0,MRFF,2022,False
Monash University,The right to rehabilitation for people with dementia: tackling stigma and implementing evidence-based interventions,Associate Professor Michele Callisaya,2022-06-01 00:00:00,2025-07-31 00:00:00,"Clinical Sciences, Geriatrics And Gerontology, Clinical Sciences, Rehabilitation And Therapy (Excl. Physiotherapy), Public Health And Health Services, Primary Health Care",1015820.66,MRFF,2022,False
Monash University,"EMBED: A stepped wedge cluster randomised trial of a tailored, integrated model of care to reduce symptoms of depression in home aged care",Associate Professor Tanya Davison,2022-06-01 00:00:00,2026-05-31 00:00:00,"Public Health And Health Services, Aged Health Care, Psychology, Health, Clinical And Counselling Psychology, Clinical Sciences, Psychiatry (Incl. Psychotherapy)",1997775.71,MRFF,2022,False
Monash University,Residential Aged Care - Enhanced Dementia Diagnosis,Doctor Darshini Ayton,2022-06-01 00:00:00,2024-12-31 00:00:00,"Public Health And Health Services, Aged Health Care",200000.0,MRFF,2022,False
Monash University,"An Integrated Method for the Assessment and Monitoring of Dementia and Cognitive Impairment: The Cognition - Optimised, Digitised, And Harmonised (C-ODH) platform",Associate Professor Yen Ying Lim,2023-02-01 00:00:00,2027-06-30 00:00:00,"Psychology, Clinical And Health Psychology, Clinical Neuropsychology, Biomedical And Clinical Sciences, Neurosciences, Neurology And Neuromuscular Diseases, Health Sciences, Health Services And Systems, Implementation Science And Evaluation",1997763.2,MRFF,2023,False
Monash University,A national critical care research platform to ensure high-quality sepsis care in Australian ICUs,Professor Andrew Udy,2023-02-01 00:00:00,2028-01-31 00:00:00,"Clinical Sciences, Intensive Care",4899778.81,MRFF,2023,False
Monash University,Expanded umbilical cord blood cells for neuroprotection in extremely preterm infants,Doctor Courtney McDonald ,2023-02-01 00:00:00,2027-01-31 00:00:00,"Paediatrics And Reproductive Medicine, Paediatrics And Reproductive Medicine Not Elsewhere Classified",590134.71,MRFF,2023,False
Monash University,"Zest – A personalised, digital intervention for sleep and wellbeing in Australian shift workers", Doctor Prerna Varma,2023-02-01 00:00:00,2026-02-28 00:00:00,"Public Health And Health Services, Environmental And Occupational Health And Safety, Public Health And Health Services, Preventive Medicine, Psychology, Psychology Not Elsewhere Classified",805255.87,MRFF,2023,False
